,Scripts,title,Character,Season
835," Ahh, you drive safe.",The One With the Two Parties,JOEY,2
836," Ross, what're you doing.",The One With the Two Parties,MRS. GREENE,2
837," I'm getting ready for the water skiing. Mr. Greene opens the door which pulls Ross"", 'in How are you doing?",The One With the Two Parties,ROSS,2
838," Well, uh, Dr. Greene, where are you going?",The One With the Two Parties,CHANDLER,2
839, To get my coat.,The One With the Two Parties,MR. GREENE,2
840, No no no.,The One With the Two Parties,GUYS,2
841,"Alright, alright, I can get my own coat.",The One With the Two Parties,MR. GREENE,2
843," Sorry, we're on a major flan high.",The One With the Two Parties, CHANDLER,2
844," Oh no, you're not supposed to be here. This is the staging area, you should, it's"", 'all wrong, you should leave, ya know, get out. opens the door, the guys are right there', ""Or perhaps you'd like a creme d'menthe.",The One With the Two Parties,PHOEBE,2
845," I have to be heading to my chateau, thank you.",The One With the Two Parties,MR. GREENE,2
846," Oh all right, then I guess we're going back into the hallway.",The One With the Two Parties,PHOEBE,2
847," Thanks for coming Mrs. Greene. grabs her and kisses her to distract her. She goes', 'limp in his arms. Mr. Greene leaves. Well, ok, you take care.",The One With the Two Parties,JOEY,2
848," Oh, you kids she caresses his face and chest Well, this is the best party', ""I've been to in years.",The One With the Two Parties,MRS. GREENE,2
849, Thank you.,The One With the Two Parties,MONICA,2
852," Ok everybody, it's time for flan.",The One With the Two Parties, MONICA,2
853," Yup, get ready for the gelatenous fun.",The One With the Two Parties,CHANDLER,2
854, Kinda looks like that stuff you get when you get a bad infection.,The One With the Two Parties,JOEY,2
855," Ok, that's enough.",The One With the Two Parties,MONICA,2
856," Ok Rachel, make a special flan wish.",The One With the Two Parties, PHOEBE,2
857," Ok, I've got one. blows out the candles. Somebody calls out 'heads up' and the"", 'volleyball lands in the flan Wow, those things almost never come true.",The One With the Two Parties,RACHEL,2
863," Ok, Chandler, Mon, there's only one bananna nut muffin left.",The One With the Chicken Pox, RACHEL,2
865," Oh, I ordered mine first.",The One With the Chicken Pox,MONICA,2
866," Yeah, but I'm, I'm so much faster...",The One With the Chicken Pox,CHANDLER,2
867, Give it to me.,The One With the Chicken Pox,MONICA,2
868, No.,The One With the Chicken Pox,CHANDLER,2
869, Give it to me.,The One With the Chicken Pox,MONICA,2
870," Ok, you can have it. He licks it and offers it to her.",The One With the Chicken Pox,CHANDLER,2
871," She grabs the coffee cup on the table and licks the rim.', 'There you go, enjoy your coffee.",The One With the Chicken Pox, MONICA,2
872, That was there when I got here. Takes a bite of his muffin.,The One With the Chicken Pox,CHANDLER,2
873," enters Hey you guys, you will never guess who's coming to New York.",The One With the Chicken Pox,PHOEBE,2
874," Chandler tries to come back with a smart-ass remark but can't swallow the"", 'muffin. Quick, Phoebe, tell us before he can swallow.",The One With the Chicken Pox,MONICA,2
875," Oh ok, Ryan, that guy I went out with, who's in the Navy.",The One With the Chicken Pox,PHOEBE,2
877, You went out with a guy in the Navy?,The One With the Chicken Pox,RACHEL,2
878," Yeah, I met him when I was playing guitar in Washington Square Park. Ryan threw in', ""salt water taffy 'cause he didn't have any change.",The One With the Chicken Pox,PHOEBE,2
879," Hey, is that when you wrote salt water taffy man?",The One With the Chicken Pox,JOEY,2
880," No. No, he is my submaring guy. He resurfaces like every couple years and we have', ""the most amazing three days together. Only this time he's coming for two weeks. Two whole"", 'weeks, which means yay.",The One With the Chicken Pox,PHOEBE,2
881," So wait, this guy goes down for like two years at a time?",The One With the Chicken Pox, RACHEL,2
883, That'll teach you to lick my muffin.,The One With the Chicken Pox,MONICA,2
884, enters Hiii.,The One With the Chicken Pox,ROSS,2
885," Oh no, what happened?",The One With the Chicken Pox,JOEY,2
886," Well, I just spoke to Carol. Ben's got the chicken pox.",The One With the Chicken Pox,ROSS,2
887, Oh no.,The One With the Chicken Pox,ALL,2
888," Yeah, so if you haven't already had it, chances are you're gonna get it.",The One With the Chicken Pox,ROSS,2
889, Well I've had it.,The One With the Chicken Pox,RACHEL,2
890," Yeah, I've had it.",The One With the Chicken Pox,JOEY,2
891, Had it.,The One With the Chicken Pox,MONICA,2
892, Had it.,The One With the Chicken Pox,CHANDLER,2
893," Well, I've never had it, I feel so left out. Sees a red bump on her arm. Oh"", 'look!",The One With the Chicken Pox,PHOEBE,2
896," Honey, you made the bed again. I told you, you don't have to"", ""do that. This isn't camp.",The One With the Chicken Pox, MONICA,2
897," Ooh, then I guess the panty raid last night was totally uncalled for. Ok, I am', ""going to take a shower and today I will be singing Jim Crochee's Leroy Brown.",The One With the Chicken Pox,RICHARD,2
899," Monica... He re-enters the bedroom and Monica jumps on the bed, trying to cover', 'it. Hey Mon, I have a question. Is Leroy the baddest man in the whole damn town or the', 'fattest man in the whole damn town?",The One With the Chicken Pox,RICHARD,2
900, Baddest. Otherwise the song would be Fat Fat Leroy Brown.,The One With the Chicken Pox,MONICA,2
901, What're you doing?,The One With the Chicken Pox,RICHARD,2
902, Just waiting for you sweetie.,The One With the Chicken Pox,MONICA,2
903, Are you remaking the bed?,The One With the Chicken Pox,RICHARD,2
904," I'm sorry, I'm sorry. You know what, the way you did it was just fine.",The One With the Chicken Pox,MONICA,2
905," Then, you're redoing it because...",The One With the Chicken Pox,RICHARD,2
906," If I tell you, you'll think I'm crazy.",The One With the Chicken Pox, MONICA,2
907, You're pretty much running that risk either way.,The One With the Chicken Pox,RICHARD,2
908," Ok, you see, the tag shouldn't be at the top left corner, it should be at the"", 'bottom right corner.",The One With the Chicken Pox,MONICA,2
909," Oh, well that's not so crazy.",The One With the Chicken Pox, RICHARD,2
910, I'm just easing you in.,The One With the Chicken Pox,MONICA,2
911," Oh, alright.",The One With the Chicken Pox,RICHARD,2
912," Alright, you see these little flower blossoms? They should be facing up, not down,', ""because, well, the head of the bed is where the sun would be. You don't love me any more"", 'do you.",The One With the Chicken Pox,MONICA,2
913," Actually, if it's possible, I love you more.",The One With the Chicken Pox,RICHARD,2
914," Really? Wow, well then come on, I wanna show you how to fold', 'the toilet paper into a point.",The One With the Chicken Pox, MONICA,2
916," Hey, look Joey, I'm just saying if you need something to hold you over, I can"", 'get you a job right here as an entry level processor.",The One With the Chicken Pox,CHANDLER,2
917, But don't you need experience for a job like that?,The One With the Chicken Pox,JOEY,2
918," It's not that hard to learn. And as for people realizing you have no idea what"", ""you're doing, hey, you're an actor. Act like a processor, people will think you're a"", 'processor.",The One With the Chicken Pox,CHANDLER,2
919," enters Hey Chandler, here's this morning's projections.",The One With the Chicken Pox,SCOTT,2
920," Hey thanks. Scott Alexander, Joey Tribbianni. Joey is a uh, fellow processor.",The One With the Chicken Pox,CHANDLER,2
921, No kidding.,The One With the Chicken Pox,SCOTT,2
922," Oh yeah yeah. I process. People want the processing, I'm the"", 'one they call.",The One With the Chicken Pox, JOEY,2
923, Where do you work?,The One With the Chicken Pox,SCOTT,2
924," Uhh, well, right now I'm in between things. You know how it is. One day you're"", ""processing, the next day you're not so much... processing any more.",The One With the Chicken Pox,JOEY,2
925, I was just telling Joey about the opening in Fleischman's group.,The One With the Chicken Pox,CHANDLER,2
926," Fleischman's group. Whatever you do, don't touch his sandwiches. Ha-ha-ha...",The One With the Chicken Pox,SCOTT,2
927, Ha-ha. Scott leaves Are all you processors dorks?,The One With the Chicken Pox,JOEY,2
929," Oh, this lipstick looks just great on you.",The One With the Chicken Pox,RACHEL,2
930," You look fabulous honey, you really do.",The One With the Chicken Pox,MONICA,2
931," Yeah? Are you sure, really. She picks up a mirror and sees the white splotches', 'all over her face.",The One With the Chicken Pox,PHOEBE,2
932," You see, you look beautiful. For god sakes, dim the lights.",The One With the Chicken Pox, RACHEL,2
933," I, I, I'm hideous.",The One With the Chicken Pox,PHOEBE,2
934," It's gonna be ok. Ryan's been under water. He's just gonna"", ""be so glad that you don't have barnicles on your butt.",The One With the Chicken Pox, MONICA,2
936, Come in.,The One With the Chicken Pox,PHOEBE,2
937," Hey baby, I'm back... Phoebe is sitting by the window in a veil.",The One With the Chicken Pox,RYAN,2
938," Hey Ryan, what's up?",The One With the Chicken Pox,PHOEBE,2
939, What's goin' on?,The One With the Chicken Pox,RYAN,2
940," Well, no no, you have to stay back. I, I have the pox.",The One With the Chicken Pox, PHOEBE,2
941, Chicken or small?,The One With the Chicken Pox,RYAN,2
942, Chicken. Which is so ironic considering I'm a vegetarian.,The One With the Chicken Pox,PHOEBE,2
943, Why aren't you at home in bed?,The One With the Chicken Pox,RYAN,2
944," 'Cause my, my grandmother's never had chicken pox. Please, please tell me you"", ""have, 'cause oh my God, I forgot how cute you are.",The One With the Chicken Pox,PHOEBE,2
945," I'm sorry, I never had 'em.",The One With the Chicken Pox,RYAN,2
946," Ohh, ohh.",The One With the Chicken Pox,PHOEBE,2
947," If I had one wish, it would be to build a time machine, go', 'back to when I was 7, when Jimmy Hauser had the chicken pox. I would grab that kid and rub', 'him all over my face.",The One With the Chicken Pox, RYAN,2
948," Yeah, or you know, you could just wish that I didn't have them now.",The One With the Chicken Pox,PHOEBE,2
949, Can I please see your face?,The One With the Chicken Pox,RYAN,2
950, Nope. You don't want to see a face covered with pox.,The One With the Chicken Pox,PHOEBE,2
951," Your face could be covered with lochs, I wouldn't care.",The One With the Chicken Pox,RYAN,2
952," And you hate fish. Oh. That's so sweet, alright. Ok, alright, you can see. This is"", 'me... she unveils herself right as a huge lightning bolt crashes outside. Ryan screams in', 'terror. Oh, I am scary.",The One With the Chicken Pox,PHOEBE,2
953," Sorry, the lightning. Lightning was an unfortunate incidence. You look lovely,', 'lovely.",The One With the Chicken Pox,RYAN,2
954," I hate this. 'Cause I tell you, I had the most amazing two"", 'weeks planned for us, and almost everything I had in mind, we had to be a lot closer than', 'this.",The One With the Chicken Pox, PHOEBE,2
955," Phoebe, I have spent the last eight months in a steel tube with men, thinking about', 'this moment. I am not gonna let a bunch of itchy spots stand between us. He walks to her', 'and kisses her.",The One With the Chicken Pox,RYAN,2
956," Ok, this is the most romantic disease I've ever had.",The One With the Chicken Pox,PHOEBE,2
958, Hey.,The One With the Chicken Pox,JOEY,2
959," Hey, how's the first day goin'?",The One With the Chicken Pox,CHANDLER,2
960," Pretty good. It's like you said. It's mostly just putting numbers from one column"", 'into another column.",The One With the Chicken Pox,JOEY,2
961, Well there you go.,The One With the Chicken Pox,CHANDLER,2
962," Hey and everbody is so nice. I just had a good talk with that lady with the red', 'hair, Jeannie.",The One With the Chicken Pox,JOEY,2
963," Jeannie, the head of east coast operations Jeannie?",The One With the Chicken Pox,CHANDLER,2
964," Yeah, turns out our kids go to the same school. Small world', 'huh?",The One With the Chicken Pox, JOEY,2
965, Weird world. Your kids?,The One With the Chicken Pox,CHANDLER,2
966, I figure my character has kids.,The One With the Chicken Pox, JOEY,2
967, Ya know there isn't a part of that sentence I don't need explained.,The One With the Chicken Pox,CHANDLER,2
968," Well, see when you're acting you need to think about stuff"", 'like that. My character, Joseph the processor guy, has two little girls, Ashley and', 'Brittany. Ashley copies everything Brittany does.",The One With the Chicken Pox, JOEY,2
969," Well, invisible kids can be that way sometimes.",The One With the Chicken Pox,CHANDLER,2
970," Yeah. Joseph and his wife, Karen, are thinking of having a', 'third kid... Ya know what? Just did.",The One With the Chicken Pox, JOEY,2
971, Really? Wow. That's some pretty powerful imaginary sperm you must have there.,The One With the Chicken Pox,CHANDLER,2
973, You know what makes the itching even worse?,The One With the Chicken Pox,RYAN,2
974, That you don't stop talking about it.,The One With the Chicken Pox,PHOEBE,2
975, Fine.,The One With the Chicken Pox,RYAN,2
976," Let's just play, ok. Good, ok. She picks up the dice. Here we go, double sixes,"", 'here we go... She starts to rub the dice all over herself. Here we go, come to mama,', 'just getting ready to roll the dice...",The One With the Chicken Pox,PHOEBE,2
977, What're you doing? Are you scratching?,The One With the Chicken Pox,RYAN,2
978," No. This is what I do for luck, ok.",The One With the Chicken Pox,PHOEBE,2
979, You're scratching. Give me the dice.,The One With the Chicken Pox,RYAN,2
980, No.,The One With the Chicken Pox,PHOEBE,2
981, Give me the dice.,The One With the Chicken Pox,RYAN,2
982," No. Here. Throws them on the table. There. Ooh, double sixes.",The One With the Chicken Pox,PHOEBE,2
983," We can't scratch. You know we can't, we'll scar.",The One With the Chicken Pox,RYAN,2
984," Uhh, I can't stop thinking about it. It's just so hard. I just wanna grab all"", ""these houses and rub 'em all over my body. Grabs a handful of the houses.",The One With the Chicken Pox,PHOEBE,2
985, No.,The One With the Chicken Pox,RYAN,2
986, Give it.,The One With the Chicken Pox,PHOEBE,2
987, No.,The One With the Chicken Pox,RYAN,2
988," Yeah, come on. You know you want it, you know you want it too, come on. Let's just"", ""be bad, it'll feel so good. She starts scratching him.",The One With the Chicken Pox,PHOEBE,2
989, Oh God help me.,The One With the Chicken Pox,RYAN,2
990," Now do me, do my back. Oh come on, harder.",The One With the Chicken Pox,PHOEBE,2
992," Oh, stop that, stop that right now.",The One With the Chicken Pox,RACHEL,2
993," You know, I might have expected this of you Phoebe, but Ryan, you're a military man.",The One With the Chicken Pox,ROSS,2
995," You and Milton have to join us on the boat. Karen'll pack a lunch, you'll bring the"", ""kids, we'll make a day of it.",The One With the Chicken Pox,JOEY,2
996," Oh, that sounds lovely. We're gonna have to set that up. Oh, I better get back."", 'Hope the baby feels better.",The One With the Chicken Pox,JEANNIE,2
997," Oh, thanks, thanks. Bye bye Jeannie.",The One With the Chicken Pox,JOEY,2
998, Bye bye Joey.,The One With the Chicken Pox, JEANNIE,2
999, What a phony.,The One With the Chicken Pox,JOEY,2
1000," Well, I'm sure you'll teach her a lesson when she steps off the dock onto"", 'nothing. Hey Mr. Douglas.",The One With the Chicken Pox,CHANDLER,2
1001, Sir.,The One With the Chicken Pox,JOEY,2
1002," Uh, listen Bing, I received your memo. So, we're not gonna receive the"", 'systems report until next Friday?",The One With the Chicken Pox,MR. DOUGLAS,2
1003, Well the people in my group wanna spend the holiday weekend with their families.,The One With the Chicken Pox,CHANDLER,2
1004," I have a family, I'm gonna be here.",The One With the Chicken Pox,MR. DOUGLAS,2
1005," Yeah Bing, what's that about?",The One With the Chicken Pox,JOEY,2
1006," It's about cutting my people a little slack, ya know, for morale. Look, if you"", 'wanna see some rough numbers, I can get them to you by Wednesday.",The One With the Chicken Pox,CHANDLER,2
1007, Rough numbers?,The One With the Chicken Pox,MR. DOUGLAS,2
1008, This company was not built on rough numbers. Am I right Mr. Douglas.,The One With the Chicken Pox,JOEY,2
1009, Have the final numbers on my desk by Tuesday.,The One With the Chicken Pox,MR. DOUGLAS,2
1010," Uh, if you say so sir.",The One With the Chicken Pox,CHANDLER,2
1011," Joseph's good, isn't he?",The One With the Chicken Pox,JOEY,2
1012," Well, I'm going to kill you.",The One With the Chicken Pox,CHANDLER,2
1013," Hey, hey, I just figure Joseph's the kinda guy that likes to mix it up. Ya know, get"", 'in there, ruffle some feathers.",The One With the Chicken Pox,JOEY,2
1014, Why?,The One With the Chicken Pox,CHANDLER,2
1015," Look, I'm sorry but that's what Joseph does, ok. If you try to pull somethin', he'll"", ""call you on it. 'What're you tryin' to pull,' he'll say.",The One With the Chicken Pox,JOEY,2
1017," Ooh, duct tape. Was I supposed to bring something too?",The One With the Chicken Pox,RICHARD,2
1018, This is for the scratchy twins out there. I taped oven mits to their hands.,The One With the Chicken Pox,MONICA,2
1019, You're strict.,The One With the Chicken Pox,RICHARD,2
1020, It's for their own good.,The One With the Chicken Pox,MONICA,2
1021," You know, I like the way you have efficiently folded this', 'tab under. See in a tape emergency you could shave valuable seconds off your time.",The One With the Chicken Pox, RICHARD,2
1022," Exactly. Oh, I love that I can be totally neurotic around', ""you now. Tell me the truth. Don't you like it better now that"", 'everything on your desk is perpendicular?",The One With the Chicken Pox, MONICA,2
1023," If it's not a right angle, it is a wrong angle.",The One With the Chicken Pox,RICHARD,2
1024, Very good.,The One With the Chicken Pox,MONICA,2
1025, Thank you.,The One With the Chicken Pox,RICHARD,2
1026, You know what. Tomorrow I'm gonna do your clocks.,The One With the Chicken Pox,MONICA,2
1027, You're gonna do what to my clocks.,The One With the Chicken Pox,RICHARD,2
1028, I'm gonna set them to my time.,The One With the Chicken Pox,MONICA,2
1029," Well, I'm confused. I thought we shared time.",The One With the Chicken Pox,RICHARD,2
1030," No no. See, in my bedroom I set my clock six minutes fast.', 'You wanna know why?",The One With the Chicken Pox, MONICA,2
1031, Because it's in a slightly different time zone than the kitchen.,The One With the Chicken Pox,RICHARD,2
1032," No forget it, I'm not gonna tell you now.",The One With the Chicken Pox,MONICA,2
1033, No come on. Come on tell me.,The One With the Chicken Pox,RICHARD,2
1034, No. See you don't understand.,The One With the Chicken Pox,MONICA,2
1035, Come on.,The One With the Chicken Pox,RICHARD,2
1036, No. You don't have any of these cute little obsessive things.,The One With the Chicken Pox,MONICA,2
1037, No that's not true. That is not true.,The One With the Chicken Pox,RICHARD,2
1038, Oh yeah.,The One With the Chicken Pox,MONICA,2
1039, Yeah.,The One With the Chicken Pox,RICHARD,2
1040," Alright, well tell me one of yours.",The One With the Chicken Pox,MONICA,2
1041," Ok. Ahh. One of my things is, I always separate my sweat socks from my dress', 'socks.",The One With the Chicken Pox,RICHARD,2
1042, What if they get mixed up?,The One With the Chicken Pox,MONICA,2
1043," Boy I would just uh, I would freak out.",The One With the Chicken Pox,RICHARD,2
1044," You would not. I can't believe this. I hate this, you're too"", ""normal. I can't believe my boyfriend doesn't have a thing. My boyfriend doesn't have a"", 'thing.",The One With the Chicken Pox, MONICA,2
1045," See, if anyone overheard that, I didn't come off well.",The One With the Chicken Pox,RICHARD,2
1047, Hey. Mr. Douglas is looking for you.,The One With the Chicken Pox,JOEY,2
1048, Why? Wh- wh- why is Mr. Douglas looking for me?,The One With the Chicken Pox,CHANDLER,2
1049, 'Cause he has a strong suspicion that you dropped the ball on the Lender project.,The One With the Chicken Pox,JOEY,2
1050," Wha- wh- why, why, why does he suspect that?",The One With the Chicken Pox,CHANDLER,2
1051," Becasue at first he thought it was Joseph. But after he asked Joseph about it, turns', 'out it was you. Anyway, I just thought you should know.",The One With the Chicken Pox,JOEY,2
1052," Alright, that's it. Look Joey, I'm sorry, I realize this is the role of a"", ""lifetime for ya, and if I could just fire Joseph, I would, but unfortunately that's not"", ""possible so I'm gonna have to let both of you go.",The One With the Chicken Pox,CHANDLER,2
1053," What're you talking about, everybody loves Joseph.",The One With the Chicken Pox,JOEY,2
1054," I don't, I hate Joseph, ok. I think he's a brown-nosing suck up.",The One With the Chicken Pox,CHANDLER,2
1055," Oh yeah. Well you can't fire Joseph. You know why, 'cause he's not in your"", 'department.",The One With the Chicken Pox,JOEY,2
1056," Alright, ok, alright. So I can't fire Joseph but uh, I can sleep with his wife.",The One With the Chicken Pox,CHANDLER,2
1057, Karen.,The One With the Chicken Pox,JOEY,2
1058," Yeah, Karen. I'm thinking about having an affair with her."", 'Oh, you know what? I just did.",The One With the Chicken Pox, CHANDLER,2
1059, Ahh. What the hell are you doing to me man.,The One With the Chicken Pox,JOEY,2
1060," Oh well it's not me, it's my character, Chandy. Yeah the"", ""rogue processor who seduces his co-worker's wives for sport and then laughs about it the"", 'next day at the water cooler. In fact, I have her panties right there in my drawer.",The One With the Chicken Pox, CHANDLER,2
1061, Really?,The One With the Chicken Pox,JOEY,2
1062," No freakshow, she's fictional.",The One With the Chicken Pox,CHANDLER,2
1063," Take it easy. If it means that much to you, I'll uh, I'll go find something else.",The One With the Chicken Pox,JOEY,2
1064, Thank you.,The One With the Chicken Pox,CHANDLER,2
1065," It's just that, I, I'm gonna miss Joseph. I liked him. His wife, she was hot."", 'Chadler pushes him out the door by the face.",The One With the Chicken Pox,JOEY,2
1067, Can I please take these off? I swear I won't scratch.,The One With the Chicken Pox,PHOEBE,2
1068," No sorry hon, Monica's orders.",The One With the Chicken Pox,RACHEL,2
1069," Comes out of the bathroom, also with oven mits on his hands. Well that wasn't"", 'easy.",The One With the Chicken Pox,RYAN,2
1070," Ok, dinner's on.",The One With the Chicken Pox,ROSS,2
1071," And there's a peach cobbler warming in the oven so the plate's gonna be hot but"", ""that shouldn't be a problem for you.",The One With the Chicken Pox,RACHEL,2
1072," Alright you kids, bye now.",The One With the Chicken Pox,ROSS,2
1073, Bye. waving,The One With the Chicken Pox,PHOEBE and RYAN,2
1074," Oh look, a low budget puppet show.",The One With the Chicken Pox, ROSS,2
1075, It's such a shame you can't see which finger I'm holding up.,The One With the Chicken Pox,PHOEBE,2
1077, Wine?,The One With the Chicken Pox,RYAN,2
1078, Please. Ryan pulls the cork with his teeth and spits it into Phoebe's mits.,The One With the Chicken Pox,PHOEBE,2
1079," Oh, I spilled some.",The One With the Chicken Pox,RYAN,2
1080, I got it. Wipes it up with her mits.,The One With the Chicken Pox,PHOEBE,2
1081," Puts his hands over Phoebe's ears. I must tell you, you look beautiful tonight.",The One With the Chicken Pox,RYAN,2
1082, What?,The One With the Chicken Pox,PHOEBE,2
1083, Sorry. You look beautiful.,The One With the Chicken Pox,RYAN,2
1084, Oh.,The One With the Chicken Pox,PHOEBE,2
1086," You know what, that's it, that's it. She rips off the mits, Ryan follows her"", 'lead.",The One With the Chicken Pox,PHOEBE,2
1089," Monica, wake up. Monica.",The One With the Chicken Pox,RICHARD,2
1090, What's up?,The One With the Chicken Pox,MONICA,2
1091, I thought of a thing.,The One With the Chicken Pox,RICHARD,2
1092, Yeah?,The One With the Chicken Pox,MONICA,2
1093," Yeah. I have to sleep, have to, on this side of the bed.",The One With the Chicken Pox,RICHARD,2
1094," No honey. You have to sleep on this side of the bed because I have to sleep on', 'this side of the bed.",The One With the Chicken Pox,MONICA,2
1095, Or so I would have you believe.,The One With the Chicken Pox,RICHARD,2
1096," No. Big deal, so you have a side of the bed, everybody has a side of the bed.",The One With the Chicken Pox,MONICA,2
1097," Hey come on, you haven't heard my reason yet.",The One With the Chicken Pox,RICHARD,2
1098," Alright, go on.",The One With the Chicken Pox,MONICA,2
1099," Ok, I have to sleep on the west side because I grew up in California and', 'otherwise the ocean would be on the wrong side.",The One With the Chicken Pox,RICHARD,2
1100," Oh my God, you're a freak.",The One With the Chicken Pox,MONICA,2
1101, Yeah. How 'bout that.,The One With the Chicken Pox,RICHARD,2
1103," So uh, Ryan, were you shipping off to?",The One With the Chicken Pox, RACHEL,2
1104, I really can't say.,The One With the Chicken Pox,RYAN,2
1105, So do you have like any nuclear weapons on board?,The One With the Chicken Pox,ROSS,2
1106, I can't say.,The One With the Chicken Pox,RYAN,2
1107," Well do you get to look through one of those like, those periscope thingys.",The One With the Chicken Pox,RACHEL,2
1108," I'm sorry, but I can't say.",The One With the Chicken Pox,RYAN,2
1109," Wow, it, it's neat learning about submarines.",The One With the Chicken Pox,ROSS,2
1110," I better get out of here, I'm gonna miss my flight.",The One With the Chicken Pox,RYAN,2
1111," Ok, I'll walk you out.",The One With the Chicken Pox,PHOEBE,2
