,Scripts,title,Character,Season
568," Ok, so let me just get this straight. So we're uh, strictly talking about the"", 'middle?",The One With the Two Bullies,CHANDLER,2
569, C'MON!,The One With the Two Bullies, BIG BULLY,2
570," Hey, hey, woah, you want some of this, huh? You want a piece of this, huh? I'm"", 'standin here, huh.",The One With the Two Bullies,ROSS,2
571," Hey, hey, those guys are takin our stuff! some guy runs off with the hat",The One With the Two Bullies,CHANDLER,2
572, Hey.,The One With the Two Bullies,ROSS,2
573, Hey.,The One With the Two Bullies,BIG BULLY,2
576," God, that was, that was amazing, that was incredible. You', 'guys, you guys kicked butt.",The One With the Two Bullies, ROSS,2
577," Us, what about you guys? Man you really, bing, gave it to old Mr. Clean back', 'there. He was a big guy.",The One With the Two Bullies,LITTLE BULLY,2
578, Yeah he was wasn't he.,The One With the Two Bullies,ROSS,2
579," Yeah, I wouldn't know having missed everything.",The One With the Two Bullies,CHANDLER,2
580," Don't do that to yourself. Any one of us could have tripped over that little"", 'girls jump-rope.",The One With the Two Bullies,BIG BULLY,2
581," So, listen guys, are we uh, are we ok here?",The One With the Two Bullies,ROSS,2
582, We're ok.,The One With the Two Bullies,LITTLE BULLY,2
583, Alright.,The One With the Two Bullies,ROSS,2
584," Ok so, can I have my hat back?",The One With the Two Bullies,CHANDLER,2
585, No.,The One With the Two Bullies,LITTLE BULLY,2
586," Huh. reaches over and grabs the hat and bolts for the door but slips and falls', 'behind the couch",The One With the Two Bullies,CHANDLER,2
589, Look at her.,The One With the Two Bullies, RACHEL,2
590, Hi Monica.,The One With the Two Bullies,CHANDLER,2
591," He-he-he, how's it goin'?",The One With the Two Bullies,JOEY,2
592, Hey nice boobs.,The One With the Two Bullies,PHOEBE,2
593," Guys guys, check this out.",The One With the Two Bullies,CHANDLER,2
595, Excellent.,The One With the Two Bullies,JOEY,2
600," So, I'll get candles and my mom's lace tablecloth, and since it's Rachel's"", ""birthday, I mean, we want it to be special, I thought I'd poach a salmon.",The One With the Two Parties,MONICA,2
601, Ohhh.,The One With the Two Parties,ALL,2
602, What?,The One With the Two Parties,MONICA,2
603," Question. Why do we always have to have parties where you', 'poach things?",The One With the Two Parties, ROSS,2
604, You wanna be in charge of the food committee?,The One With the Two Parties,MONICA,2
605, Question two. Why do we always have to have parties with committees?,The One With the Two Parties,ROSS,2
606, Really. Why can't we just get some pizzas and get some beers and have fun?,The One With the Two Parties,JOEY,2
607, Yeah.,The One With the Two Parties,ROSS,2
608," Yeah, I agree. Ya know, I think fancy parties are only fun', ""if you're fancy on the inside and I'm just not sure we are.",The One With the Two Parties, PHOEBE,2
609," Alright. If you guys don't want it to be special, fine. You can throw any kind of"", 'party you want.",The One With the Two Parties,MONICA,2
611," Joey they're not real. I start miles beneath the surface of"", ""these things, ok, they're fake. See squeezes her breast honk honk.",The One With the Two Parties, MONICA,2
612," Wow, it's, it's like porno for clowns.",The One With the Two Parties,CHANDLER,2
615," I talked to Rachel's sisters, neither of them can come.",The One With the Two Parties,ROSS,2
616," Ok, um so, I still have to invite Dillon and Emma and Shannon Cooper.",The One With the Two Parties,MONICA,2
617," Woah, woah, woah, uh, no Shannon Cooper.",The One With the Two Parties, JOEY,2
618, Why not her?,The One With the Two Parties,PHOEBE,2
619," Cause she uh, she steals stuff.",The One With the Two Parties,JOEY,2
620," Or maybe she doesn't steal stuff and Joey just slept with her and never called"", 'her back.",The One With the Two Parties,CHANDLER,2
621, Joey that is horriable.,The One With the Two Parties,MONICA,2
622," Hey I liked her, alright. Maybe, maybe too much. I don't know"", 'I guess I just got scared.",The One With the Two Parties, JOEY,2
623," I'm sorry, I didn't know.",The One With the Two Parties,PHOEBE,2
624," I didn't think anyone'd buy that, ok.",The One With the Two Parties,JOEY,2
626," Hi honey, how did it go?",The One With the Two Parties, ROSS,2
627," Agh, it was the graduation from hell.",The One With the Two Parties,RACHEL,2
628," Ya know, my cousin went to hell on a football scholarship.",The One With the Two Parties,CHANDLER,2
629," Ya know, I mean this is supposed to be a joyous occasion. My', ""sister's graduating from college, nobody thought she would. It's a true testament to what"", 'a girl from long island would do for a Celica.",The One With the Two Parties, RACHEL,2
630, So what happened?,The One With the Two Parties,MONICA,2
631," My parents happened. All they had to do was sit in the same stadium, smile', 'proudly, and not talk about the divorce. But nooo, they got into a huge fight in the', 'middle of the commencement address. Bishop Tutu actually had to stop and shush them. But', 'you know what, you know what the good news is? I get to serve coffee for the next 8 hours.",The One With the Two Parties,RACHEL,2
632," Ok, so I guess we don't invite her parents.",The One With the Two Parties, PHOEBE,2
633," Well, how bout just her mom?",The One With the Two Parties,MONICA,2
634, Why her mom?,The One With the Two Parties,CHANDLER,2
635, Cause I already invited her.,The One With the Two Parties,MONICA,2
636," Ooh, ooh, did you ask Stacy Roth?",The One With the Two Parties,PHOEBE,2
637," Oh no, can't invite her. She also steals.",The One With the Two Parties,JOEY,2
639," Ok, here are the birthday candles. Where's the birthday cake?",The One With the Two Parties,PHOEBE,2
640," Ok, we're not having birthday cake, we're having birthday flan.",The One With the Two Parties,MONICA,2
641, Excuse me?,The One With the Two Parties,CHANDLER,2
642, It's a traditional Mexican custard dessert.,The One With the Two Parties, MONICA,2
643," Oh that's nice. Happy birthday Rachel, here's some goo.",The One With the Two Parties,JOEY,2
645," answers the door Dr. Greene. Oh my God it's Rachel's dad. What're you doing"", 'here?",The One With the Two Parties,MONICA,2
646, What? The father can't drop by to see the daughter on her birthday?,The One With the Two Parties,MR. GREENE,2
647," No no, the father can, but um, since I am the roommate I can tell you that she's"", ""not here and I'll pass along the message, ok. So bye-bye.",The One With the Two Parties,MONICA,2
648," Ohhh, you're having a parteee.",The One With the Two Parties,MR. GREENE,2
649," No, no, not a party. Just a surprise gathering of some people Rachel knows. Um,', 'this is Phoebe and Chandler and Joey.",The One With the Two Parties,MONICA,2
650," I'll never remember all of that. So uh, what's the deal?"", 'Rachel comes home, people pop out and yell stuff, is that it?",The One With the Two Parties, MR. GREENE,2
651," This isn't your first surprise party, is it sir?",The One With the Two Parties,CHANDLER,2
653, Hi Monica.,The One With the Two Parties,MRS. GREENE,2
655, Chinese menu guy. Forgot the menus.,The One With the Two Parties, MONICA,2
656," So, basically just a Chinese guy.",The One With the Two Parties,CHANDLER,2
657," Uh, hey, Dr. Greene, why don't you come with me, we'll put your jacket on Rachel's"", 'bed.",The One With the Two Parties,JOEY,2
658," Alright, that sounds like a two person job. they walk into Rachel's bedroom",The One With the Two Parties,MR. GREENE,2
659," Well, my goodness, what was that?",The One With the Two Parties,MRS. GREENE,2
660," Sandra, I am so sorry, I thought you were Rachel and we just weren't ready for you"", 'yet.",The One With the Two Parties,MONICA,2
661, You thought I was Rachel?,The One With the Two Parties, MRS. GREENE,2
662," Yes because uh, you look so young.",The One With the Two Parties,CHANDLER,2
663," And because you're both, you know, white women.",The One With the Two Parties,PHOEBE,2
664," Oh, I missed you kids. Well, should I put my coat in the bedroom?",The One With the Two Parties,MRS. GREENE,2
665," NO! No, I'll take that for ya.",The One With the Two Parties,CHANDLER,2
666," Oh well thank you. Such a gentleman. Thank you. Chandler takes the hot pink', 'coat and grimaces at it Ahh, it all looks so nice, so festive, all the balloons...', 'Chandler, remembering that Joey and Mr. Greene are in the bedroom, throws her coat in a', 'cupboard The funniest thing happened to me on the way here. I was...Joey peeks out",The One With the Two Parties,MRS. GREENE,2
667," cutting Mrs. Greene off Ha-ha, that's great, ha-ha. I can't wait to hear the"", 'rest of it, ya know, but I really have to go to the bathroom so... Hey, come with me.', ""Yeah, yeah, it'll be like we're gal pals, ya know, like at a restraunt. Oh, it'll be fun,"", ""c'mon. they go in the bathroom",The One With the Two Parties,PHOEBE,2
668," Oh my God, oh my God, oh my God.",The One With the Two Parties,MONICA,2
669," Ok, think, what would Jack and Chrissy do?",The One With the Two Parties, CHANDLER,2
670," peeks back out Ok, now that your coat is safely in the bedr-, sees that the coast', 'is clear oh, ok we can come back out in the living room.",The One With the Two Parties,JOEY,2
671," So uh, Joey and Chanlder, I, I think it's time that you take Dr. Greene over to"", 'your place.",The One With the Two Parties,MONICA,2
672," Uhh, yes, absdolutely, um. Why again?",The One With the Two Parties,CHANDLER,2
673, Because that's where the party is you goon. See this is just the staging area.,The One With the Two Parties,MONICA,2
674, Right this is staging.,The One With the Two Parties,JOEY,2
675," Yeah, this more than anything else, is the staging area.",The One With the Two Parties,CHANDLER,2
676," as they're walking out, Dr. Greene questioningly gestures at the Happy Birthday"", 'sign over the door This is clearly in the wrong apartment. they all walk across the', 'hall",The One With the Two Parties,JOEY,2
678," Alright you guys are off to party number one ushers 3 guys into Monica's"", 'apartment and you, you are off to party number two ushers four women into his apartment.', ""Two guys try to follow and Chandler blocks them and shoos them off to Monica's apartment"", ""Alright fellas, let's keep it movin', let' keep it movin.",The One With the Two Parties,CHANDLER,2
679," Chandler could you at least send some women to my party? buzzer goes off Alright', ""that's Ross.",The One With the Two Parties,MONICA,2
680," Ok, they're coming, shhh. Runs into Monica's apartment and grabs one last girl"", 'to take to his apartment",The One With the Two Parties,CHANDLER,2
681," Ohh, thank you for the wonderful dinner.",The One With the Two Parties,RACHEL,2
682, Thanks for being born.,The One With the Two Parties,ROSS,2
683," Ohh, thank you for my beautiul earrings, they're perfect. I"", 'love you.",The One With the Two Parties, RACHEL,2
684," Oh, now you can exchange them if you want, ok.",The One With the Two Parties,ROSS,2
685, Now I love you even more.,The One With the Two Parties,RACHEL,2
687, Surprise.,The One With the Two Parties,ALL,2
688," Oh my gosh, wow. Monica. Oh my god. Mom. This is so great.",The One With the Two Parties,RACHEL,2
689, Happy birthday sweetie.,The One With the Two Parties,MRS. GREENE,2
690," Wow you, you. I had no idea.",The One With the Two Parties,RACHEL,2
691, Really?,The One With the Two Parties,ROSS,2
692," No, I knew.",The One With the Two Parties,RACHEL,2
693, All right.,The One With the Two Parties,ROSS,2
694," Ok, everybody, there's food and drinks on the table. Go across the hall.",The One With the Two Parties,MONICA,2
695, What?,The One With the Two Parties,ROSS,2
696, What?,The One With the Two Parties,RACHEL,2
697," Right now, Joey and Chandler's, go now.",The One With the Two Parties,MONICA,2
698, Why.,The One With the Two Parties,RACHEL,2
699, Just go.,The One With the Two Parties,MONICA,2
701, Surprise.,The One With the Two Parties,ALL,2
702, Happy birthday sweetpea.,The One With the Two Parties,MR. GREENE,2
703, Daddy.,The One With the Two Parties,RACHEL,2
705," Both of them are here, both of them, both of them are here?",The One With the Two Parties, RACHEL,2
706," Well, we could count again.",The One With the Two Parties,CHANDLER,2
707, I can't believe this is happening.,The One With the Two Parties,RACHEL,2
708," You know what, this is ridiculous, ok. This is your birthday,', ""this is your party. I say we just put 'em all together and if they can't deal with it, who"", 'cares.",The One With the Two Parties, ROSS,2
709, I do.,The One With the Two Parties,RACHEL,2
710, That's who.,The One With the Two Parties,ROSS,2
711," Look, are you gonna be ok?",The One With the Two Parties,CHANDLER,2
712," Well, I have to be, I don't really have a choice, I mean, you know, I could look"", 'at the bright side, I get two birthday parties and two birthday cakes.",The One With the Two Parties,RACHEL,2
713," Well, actually just one birthday flan.",The One With the Two Parties,CHANDLER,2
714, What?,The One With the Two Parties,RACHEL,2
715," It's a traditional Mexican custard dessert...Look talk to Monica, she's on the"", 'food committee.",The One With the Two Parties,CHANDLER,2
717," Joey, Joey. Hey, some girl just walked up to me and said, 'I want you Dennis,'"", 'and stuck her tounge down my throat. I love this party.",The One With the Two Parties,CHANDLER,2
718, Quick volleyball question.,The One With the Two Parties,JOEY,2
719, Volleyball.,The One With the Two Parties,CHANDLER,2
720," Yeah, we set up a court in your room. Uh, you didn't really"", 'like that grey lamp, did you?",The One With the Two Parties, JOEY,2
721," Joey, a woman just stuck her tounge down my throat, I'm not even listening to"", 'you.",The One With the Two Parties,CHANDLER,2
722, Dennis.,The One With the Two Parties,GIRL'S VOICE,2
723," Ok, that's me. runs back",The One With the Two Parties,CHANDLER,2
724," Listen honey, can you keep dad occupied, I'm gonna go talk to mom for a while.",The One With the Two Parties,RACHEL,2
725," Ok, do you have any ideas for any openers?",The One With the Two Parties, ROSS,2
726," Uhh, let's just stay clear of 'I'm the guy that's doing you daughter' and you"", 'should be ok.",The One With the Two Parties,RACHEL,2
728," Ok people, I want you to take a piece of paper, here you go, and write down your', ""most embarassing memory. Oh, and I do ask that when you're not using the markers, you put"", 'the caps back on them because they will dry out.",The One With the Two Parties,MONICA,2
730," Hi Dr. Greene. So, uh, how's everything in the uh, vascular"", 'surgery....game?",The One With the Two Parties, ROSS,2
731," It's not a game Ross, a woman died on my table today.",The One With the Two Parties,MR. GREENE,2
732," I'm sorry. See that's the good thing about my job. All the dinosaurs on my table are"", 'already dead.",The One With the Two Parties,ROSS,2
734," Listen you guys, I don't mean to be a pain about this but, um, I've noticed that"", 'some of you are just placing them on. You wanna push the caps until you hear them click.', ""she demonstrates, Gunther starts to walk to the door Gunther, where're you going?",The One With the Two Parties,MONICA,2
735," I um, was sorta thinking about maybe...",The One With the Two Parties,GUNTHER,2
736," No. No you can't go. No this is fun. Come on we're just getting started. Here,"", ""here's your marker.",The One With the Two Parties,MONICA,2
737," Listen if you wanna go, just go.",The One With the Two Parties,PHOEBE,2
738," No, she'll yell at me again.",The One With the Two Parties,GUNTER,2
739," Alright, I can get you out.",The One With the Two Parties,PHOEBE,2
740, What?,The One With the Two Parties,GUNTHER,2
741," Shh. In a minute, I'm gonna create a diversion. When I do, walk quickly to the"", ""door and don't look back.",The One With the Two Parties,PHOEBE,2
743, I think I need a drink.,The One With the Two Parties,MR. GREENE,2
744," Oh, here, I, I'll get it for ya. Whad'ya want?",The One With the Two Parties,ROSS,2
745, Scotch.,The One With the Two Parties,MR. GREENE,2
746," Scotch. Alright, I'll be back in 10 seconds with your scotch on the rocks in a"", 'glass.",The One With the Two Parties,ROSS,2
747, Neat.,The One With the Two Parties,MR. GREENE,2
748, Cool.,The One With the Two Parties,ROSS,2
749," No no no, no no no, neat, as in no rocks.",The One With the Two Parties,MR. GREENE,2
750, I know.,The One With the Two Parties,ROSS,2
752," Oh hello Ross, where have you been?",The One With the Two Parties,MR. GREENE,2
753," Hi. Uh, I have been in the bathroom. Stay clear of the salmon mousse.",The One With the Two Parties,ROSS,2
754," Oh, scotch neat. Ya know, that's Rachel's father's drink.",The One With the Two Parties,MRS. GREENE,2
755," Oh, mine too. Isn't that neat, scotch neat. Would you excuse me? walks out in the"", ""hallway, Mr. Greene is walking out of Chandler and Joey's apartment Hey, hey, where you"", 'uh, sneakin off to mister?",The One With the Two Parties,ROSS,2
756, I'm getting my cigarettes out of my jacket.,The One With the Two Parties,MR. GREENE,2
757, No. no.,The One With the Two Parties,ROSS,2
758, Whad'ya mean no?,The One With the Two Parties,MR. GREENE,2
759," No, um, see 'cause that, that is, that is the staging area. If you go in there,"", ""it'll ruin the whole illusion of the party. Yeah, I think you take your scotch back in"", 'there and I will get your cigarettes for you sir.",The One With the Two Parties,ROSS,2
760, Get my glasses too.,The One With the Two Parties, MR. GREENE,2
761," All righty roo. closes the door What a great moment to say that for the first', 'time. goes to get the cigarettes and glasses",The One With the Two Parties,ROSS,2
762," Ok, the first person's most embarassing memory is, 'Monica, your party sucks.'"", 'Very funny.",The One With the Two Parties,MONICA,2
763," Oh no, ooh, ooh, did somebody forget to use a coaster?",The One With the Two Parties, PHOEBE,2
764," What? she runs over to where Phoebe is, Phoebe signals for Gunther to go I don't"", 'see anything.",The One With the Two Parties,MONICA,2
765," Great, I'm seeing water rings again.",The One With the Two Parties,PHOEBE,2
766," Ross, whose glasses are those?",The One With the Two Parties,MRS. GELLER,2
767, Mine.,The One With the Two Parties,ROSS,2
768, You wear bi-focals?,The One With the Two Parties,MRS. GREENE,2
769," Um-hmm. puts them on I have a condition, apparently, that I require two different', 'sets of focals.",The One With the Two Parties,ROSS,2
770, Did you know my husband has glasses just like that?,The One With the Two Parties,MRS. GREENE,2
771, Well those are very popular frames.,The One With the Two Parties,RACHEL,2
772, Neil Sedaka wears them.,The One With the Two Parties,ROSS,2
773, to Phoebe I hear you can get people out of here.,The One With the Two Parties,GUY,2
774," Rachel, you didn't tell me your boyfriend smoked.",The One With the Two Parties,MRS. GREENE,2
775," Yeah, like a chimney.",The One With the Two Parties,RACHEL,2
776," Ohh, big smoker. Packs the cigarettes and flings one on Mrs. Greene in the process.', ""Finally gets one in his mouth and it look really out of place Big big smoker. In fact I'm"", 'gonna go ou into the hallway and fire up this bad boy. as he walks into the hall, he', 'comes face to face with Mr. Greene",The One With the Two Parties,ROSS,2
777, Are you wearing my glasses?,The One With the Two Parties, MR. GREENE,2
778," Yes. pulls them off and hands them to Mr. Greene I was just warming up the', 'earpieces for you.",The One With the Two Parties,ROSS,2
779, Thank you. Is that one of my cigarettes?,The One With the Two Parties,MR. GREENE,2
780," pulls the cigarette off his upper lip and hands it to Mr. Greene Yeah, yes it is,', 'I was just moistening the tip.",The One With the Two Parties,ROSS,2
782," Ok, ok, she's taking the trash out so I can get you out of"", ""here but it has to be now, she'll be back any minute.",The One With the Two Parties, PHOEBE,2
783, What about my friend Victor?,The One With the Two Parties,GIRL 1,2
784," No, only the three of you, any more than that and she'll get suspicious.",The One With the Two Parties,PHOEBE,2
785," Alright, let me just get my coat.",The One With the Two Parties,GIRL 1,2
786, There isn't time. You must leave everything. They'll take care of you next door.,The One With the Two Parties,PHOEBE,2
787, Is it true they have beer?,The One With the Two Parties,GIRL 1,2
788, Everything you've heard is true.,The One With the Two Parties,PHOEBE,2
790," Could you guys please try to keep it down, we're trying to start a Boggle"", 'tournament.",The One With the Two Parties,MONICA,2
792," You, and you, you're supposed to be at my party. And Gunther! What are you doing"", 'here?",The One With the Two Parties,MONICA,2
793, Um gestures to dance floor,The One With the Two Parties,GUNTHER,2
794," enters with the three people she got out Ok, welcome to the fu-oh.",The One With the Two Parties,PHOEBE,2
795, Phoebe.,The One With the Two Parties,MONICA,2
796," Alright, I'm sorry but these people needed me. They work hard all week, it's"", 'Saturday night, they deserve to have a little fun. Go.",The One With the Two Parties,PHOEBE,2
797," Ya know, my party is fun. I mean, maybe it's a little quieter, less obvious sorta"", 'fun but, you know, if people would just give it a chance... volleyball hits her in the', 'head from behind",The One With the Two Parties,MONICA,2
799, You want me to see a therapist?,The One With the Two Parties,RACHEL,2
800," Sweetheart, you obviously have a problem. You've chosen a boyfriend exactly"", 'like your father.",The One With the Two Parties,MRS. GREENE,2
801," Ok mom, you know what, fine, I'll make an appointment ok, but you know what, right"", 'now, I gotta go, I gotta go do a thing.",The One With the Two Parties,RACHEL,2
803," Did you know your mother spent $1200 dollars on bansai trees. I felt like', 'Gulliver around that place.",The One With the Two Parties,MR. GREENE,2
804," Daddy, daddy, you know what, I really wanna hear more about this, I really do, but', 'I just have, I just have to do a, some stuff.",The One With the Two Parties,RACHEL,2
806," You work and you work and you work at a marriage but all he cares about is', 'his stupid boat.",The One With the Two Parties,MRS. GREENE,2
808, You work and you work and you work on a boat...,The One With the Two Parties,MR. GREENE,2
809, He always ridiculed my pottery classs...,The One With the Two Parties,MRS. GREENE,2
810, ...and you sand it and you varnish it...,The One With the Two Parties,MR. GREENE,2
811," ...but when all is said and done, he still drinks out of the mugs.",The One With the Two Parties,MRS. GREENE,2
812, ...and her yoga and her Bridges of Madison County...,The One With the Two Parties,MR. GREENE,2
813, ...the scotch and the cigarettes...,The One With the Two Parties,MRS. GREENE,2
814, ...and the bansai's and the chiuaua...,The One With the Two Parties,MR. GREENE,2
815, ...I may have only been in therapy for three weeks now dear but...,The One With the Two Parties,MRS. GREENE,2
816, ...what the hell does she want with half a boat...,The One With the Two Parties,MR. GREENE,2
818," running out of his apartment after a girl Ok, ok, you can be shirts and I'll"", ""be skins. I'll be skins. sits down beside Rachel Hey, how you holdin' up there, tiger?"", 'Oh, sorry, when my parents were getting divorced I got a lot of tigers. Got a lot of', 'champs, chiefs, sports, I even got a governor.",The One With the Two Parties,CHANDLER,2
819," This is it, isn't it? I mean, this is what my life is gonna"", ""be like. My mom there, my dad there. Thanksgiving, Christmas. She gets the house, he's in"", ""some condo my sister's gonna decorate with wicker. Oh, Chandler how did you get through"", 'this?",The One With the Two Parties, RACHEL,2
820," Well, I relied on a carefully regimented program of denial and, and wetting the', 'bed.",The One With the Two Parties,CHANDLER,2
821," Ya know, I just, so weird. I mean I was in there just', 'listening to them bitch about each other and all I kept thinking about was the fourth of', 'July.",The One With the Two Parties, RACHEL,2
822, Becasue it reminded you of the way our forefathers used to bitch at each other?,The One With the Two Parties,CHANDLER,2
823," It's just this thing. Every year we would go out on my dad's boat and watch the"", 'fireworks. Mom always hated it because the ocean air made her hair all big. My sister Jill', 'would be throwing up over the side and my dad would be upset becasue nobody was helping', 'and then when we did help he would scream at us for doing it wrong. But then when the', ""fireworks started, everybody just shut up, you know, and it'd get really cold, and we"", 'would all just sort of smush under this one blanket. It never occured to anybody to bring', ""another one. And now it's just...",The One With the Two Parties,RACHEL,2
824," I, I know. Hugs her. Ross walks out and Chandler puts her in his arms.",The One With the Two Parties,CHANDLER,2
826," Ok, thanks for coming, I hope you guys had fun.",The One With the Two Parties,MONICA,2
827," Alright, Monica dear, I'm gonna hit the road. Now I've left my 10 verbs on"", 'the table. And you be sure and send me that finished poem.",The One With the Two Parties,MRS. GREENE,2
828, Ok will do. So glad you came.,The One With the Two Parties,MONICA,2
829, I think I saw Rachel out in the hall.,The One With the Two Parties,MRS. GREENE,2
830," Ok, let me go check. Your mom want's to say goodbye.",The One With the Two Parties,MONICA,2
831, Oh ok.,The One With the Two Parties,RACHEL,2
832, Happy birthday sweetie.,The One With the Two Parties,MRS. GREENE,2
833, Ok.,The One With the Two Parties,RACHEL,2
