,Scripts,title,Character,Season
280," Ok honey, you really need a job.",The One With the Two Bullies,RACHEL,2
281," Mon, speaking of which, dad says he knows someone you can call for an interview.",The One With the Two Bullies,ROSS,2
282, Really.,The One With the Two Bullies,MONICA,2
283," Ok, right there. That, that's the third sign today. Right"", 'there.",The One With the Two Bullies, PHOEBE,2
284," On behalf of everyone, I'd just like to say behuh.",The One With the Two Bullies,ROSS,2
285," No, 'cause you just said dad and everywhere I go today I"", 'keep getting signs telling me to go see my father. Like when I was walking over here and I', ""passed a buffet...which is my father's last name.",The One With the Two Bullies, PHOEBE,2
286, Ahh.,The One With the Two Bullies,EVERYONE,2
287," And they were serving franks which is his first name minus the s at the end. And', 'there was a rotisserie with spinning chicken.",The One With the Two Bullies,PHOEBE,2
288, His indian name?,The One With the Two Bullies,MONICA,2
289," No because I chickened out the last time when I tried to meet him. So I mean', ""coincidences? I don't think so.",The One With the Two Bullies,PHOEBE,2
290, Freakish.,The One With the Two Bullies,ROSS,2
291, Wow.,The One With the Two Bullies,MONICA,2
292, Freaky.,The One With the Two Bullies,JOEY,2
293," Weird, weird.",The One With the Two Bullies,MONICA,2
294," Ok, so uh, who wants the last hamburger?",The One With the Two Bullies, RACHEL,2
295," Oh, alright, that's it, now I have to go see him.",The One With the Two Bullies,PHOEBE,2
296, Why?,The One With the Two Bullies,MONICA,2
297," Hamburger. McDonald's. Old MacDonald had a farm, my dad is a pharmacist.",The One With the Two Bullies,PHOEBE,2
300," Man, I am so beat.",The One With the Two Bullies, CHANDLER,2
301, Oh yeah.,The One With the Two Bullies,ROSS,2
302," Hey, you just wanna forget about raquetball and hang out here?",The One With the Two Bullies,CHANDLER,2
303, Yeah alright.,The One With the Two Bullies,ROSS,2
305, walks back from the counter Hey you're in our seats.,The One With the Two Bullies, BIG BULLY,2
306," Oh, sorry we didn't know.",The One With the Two Bullies,ROSS,2
307," walks back from the counter Hey, we were sitting there.",The One With the Two Bullies,LITTLE BULLY,2
308," Ok, there is one more way to say it, who knows it?",The One With the Two Bullies,CHANDLER,2
309, Is that supposed to be funny?,The One With the Two Bullies, LITTLE BULLY,2
310," No actually, I was just going for colorful.",The One With the Two Bullies,CHANDLER,2
311, What's with this guy?,The One With the Two Bullies,BIG BULLY,2
312, What's with you?,The One With the Two Bullies,LITTLE BULLY,2
313," Uh, nothing, nothing's with him. Enjoy your coffee.",The One With the Two Bullies,ROSS,2
315, What just happened?,The One With the Two Bullies,CHANDLER,2
316," I just took your hat. See, I can be funny too. My, my joke is that I, I took', 'your hat.",The One With the Two Bullies,LITTLE BULLY,2
317," That, that is funny. Can I have it back?",The One With the Two Bullies,CHANDLER,2
318, No.,The One With the Two Bullies,LITTLE BULLY,2
319, No?,The One With the Two Bullies,CHANDLER,2
320, No.,The One With the Two Bullies,BIG BULLY,2
321," Ok, ok, you know what? I think you're very funny. Kudos on that hat joke. But, come"", 'on guy just, just give him back the hat.",The One With the Two Bullies,ROSS,2
322, Why should we?,The One With the Two Bullies,BIG BULLY,2
323," Because it's a special hat. Chandler looks at Ross funny See"", ""he bought it 'cause he was feeling really down one day so he got the hat to cheer himself"", 'up, ya know. Now Chandler...",The One With the Two Bullies,ROSS,2
324," Stop talking, stop talking now. Let me just get this straight. You're actually"", 'stealing my hat?",The One With the Two Bullies,CHANDLER,2
325, You got a problem with that?,The One With the Two Bullies,BIG BULLY,2
326," No, just wanna make sure we're on the same page.",The One With the Two Bullies,CHANDLER,2
328," Hey, how'd the interview go?",The One With the Two Bullies,RACHEL,2
329," It bit. It was a 50's theme restraunt. I have to cook in a costume and dance on"", 'the counter. I mean I was a chef at Cafe des Artistes. I mean how', 'could I take a job where I have to make something called Laverne and Curly Fries?",The One With the Two Bullies,MONICA,2
330, So don't do it.,The One With the Two Bullies,RACHEL,2
331, How can I not do it? I have $127 in the bank.,The One With the Two Bullies,MONICA,2
332," Monica, relax, go get a beer.",The One With the Two Bullies, JOEY,2
333, I don't want a beer.,The One With the Two Bullies,MONICA,2
334, Who said it was for you?,The One With the Two Bullies,JOEY,2
335, both enter looking down Hhhiiii.,The One With the Two Bullies,ROSS and CHANDLER,2
336, What's the matter with you?,The One With the Two Bullies,RACHEL,2
337, The mean guys at the coffee house took my hat.,The One With the Two Bullies, CHANDLER,2
338, Noo.,The One With the Two Bullies,RACHEL,2
339, You're kiddin'.,The One With the Two Bullies,JOEY,2
340," It was ridiculous. Ya know, these guys, they were bullies, actual bullies, ya know.  We're grown ups, this kinda stuff isn't supposed to happen anymore.",The One With the Two Bullies,ROSS,2
341, Oohhh.,The One With the Two Bullies,RACHEL,2
342, Hi.,The One With the Two Bullies,ROSS,2
343, Hi. Ross turns to Rachel and they hug,The One With the Two Bullies,RACHEL,2
344," Ohhh turns as if to hug someone Oh no, wait a minute, I have no one.",The One With the Two Bullies,CHANDLER,2
345," Hey, woah, let's go down there and get your hat back.",The One With the Two Bullies, JOEY,2
346," Na, forget it, it's probably stripped and sold for parts by now.",The One With the Two Bullies,CHANDLER,2
347," seeing TV Hey, I went up.",The One With the Two Bullies,MONICA,2
348, What?,The One With the Two Bullies,RACHEL,2
349," My stock, MEG, it went up 2 points. Hey guys, do you realize that if I had', ""invested my $127 in myself yesterday that I'd like have...a lot more than that today. Ya"", ""know what, I'm gonna do it.",The One With the Two Bullies,MONICA,2
350, Do what?,The One With the Two Bullies,JOEY,2
351, Put all my money in me.,The One With the Two Bullies,MONICA,2
352," Monica, what are you talking about? You don't know the first thing about the stock"", 'market.",The One With the Two Bullies,RACHEL,2
353," What's to know? Buy sell, high low, bears bulls...on the"", 'phone Yes Manhattan...yeah telephone number of the stock...selling store.",The One With the Two Bullies, MONICA,2
356," See, didn't I tell ya these pillows would be a good idea?",The One With the Two Bullies,JOEY,2
357," Oh God, here we go. For the first time in my life I'm gonna say 'Hi birthfather'.",The One With the Two Bullies,PHOEBE,2
358," We love you, we're here for you.",The One With the Two Bullies,RACHEL,2
359," Yeah good luck, good luck.",The One With the Two Bullies,JOEY,2
360, Thanks. gets out of the cab,The One With the Two Bullies,PHOEBE,2
361," Hey Rach, you uh, you want some sandwich?",The One With the Two Bullies, JOEY,2
362," Ohh, what is in that?",The One With the Two Bullies,RACHEL,2
363," Olive loaf and ham spread, no mayo.",The One With the Two Bullies,JOEY,2
364," No no, 'cause mayo, that would make it gross.",The One With the Two Bullies,RACHEL,2
365," a little dog starts attacking her leg Hey, hey, no, oh oh.",The One With the Two Bullies,PHOEBE,2
366, Run Phoebe run.,The One With the Two Bullies,RACHEL,2
367," No no no, doggie please. Oh, I do so wanna love all animals,', 'please no.",The One With the Two Bullies, PHOEBE,2
368," Get him a bone, get a bone. You gotta bone?",The One With the Two Bullies,JOEY,2
369, Are you kidding me?,The One With the Two Bullies,RACHEL,2
370," Look kibbles, bits. Oh God, alright, get the hell off my leg you yippity piece of', 'crap. Flings the dog off and jumps in the cab. The dog keeps jumping up to the window.', 'Ok, alright, we have a problem.",The One With the Two Bullies,PHOEBE,2
371, Well why don't you just reach out and take his trampoline.,The One With the Two Bullies,JOEY,2
372," Ok, here, I know what we can do. grabs Joey's sadwich and throws it out the"", 'window",The One With the Two Bullies,RACHEL,2
373," Hey, hey, hey no.",The One With the Two Bullies,JOEY,2
374," Ok, doggie get the- aahhh. Ok go get the sandwich, get the', 'sandwich doggie. dog ignores the sandwich Good doggie get the sandwich, get the...ok,', 'Joey, the dog will lick himself but he will not touch your sandwich, what does that say?",The One With the Two Bullies, RACHEL,2
375," Well if he's not gonna eat it, I will.",The One With the Two Bullies,JOEY,2
376, Are you crazy?,The One With the Two Bullies,PHOEBE,2
377," Phoebs, he's just a little dog. turns back to the car window and the dog is halfway"", 'through it. Ahhh.",The One With the Two Bullies,JOEY,2
379, Hey.,The One With the Two Bullies,CHANDLER,2
380, What?,The One With the Two Bullies,ROSS,2
381," Do you have to be a Century 21 real-estate agent to get to', 'wear those really cool jackets?",The One With the Two Bullies, CHANDLER,2
382, Do you say this stuff to girls?,The One With the Two Bullies,ROSS,2
383," Hehehehey, isn't that the guy who used to wear your hat?",The One With the Two Bullies,BIG BULLY,2
384, And look where they're sitting.,The One With the Two Bullies,LITTLE BULLY,2
385," You're joking, right? You guys just walked through the door.",The One With the Two Bullies,ROSS,2
386, Maybe we didn't make it clear enough.,The One With the Two Bullies,BIG BULLY,2
387, Yeah.,The One With the Two Bullies,LITTLE BULLY,2
388, This couch belongs to us.,The One With the Two Bullies, BIG BULLY,2
389," Alright, I'll tell you what, you call the couch and then, and then we'll call"", ""the couch, and we'll see who it comes to.",The One With the Two Bullies,CHANDLER,2
390, You know what I keep wondering? Why you two are still sitting here.,The One With the Two Bullies,BIG BULLY,2
391," Alright, that's it. I've had enough of this, alright. Gunther,"", 'these guys are trying to take our seat.",The One With the Two Bullies, ROSS,2
392," Fellas, these guys were here first.",The One With the Two Bullies,GUNTHER,2
393," Oh, sorry, I didn't realize.",The One With the Two Bullies,BIG BULLY,2
394, Sorry.,The One With the Two Bullies,LITTLE BULLY,2
395, There you go.,The One With the Two Bullies,GUNTHER,2
396, Thank you Gunther. We didn't want to have to go and do that.,The One With the Two Bullies,ROSS,2
397, He told on us?,The One With the Two Bullies, LITTLE BULLY,2
398, You told on us?,The One With the Two Bullies,BIG BULLY,2
399," Well pal, you didn't give me much of a choice. flicks the ends of the big bully's"", 'tie",The One With the Two Bullies,ROSS,2
400, Don't play with his things.,The One With the Two Bullies,CHANDLER,2
401, I know.,The One With the Two Bullies,ROSS,2
402," Alright, let's take this outside.",The One With the Two Bullies, BIG BULLY,2
403," Let's, let's take this outside? Who talks like that?",The One With the Two Bullies,ROSS,2
404, The guy that's about to kick your ass talks like that.,The One With the Two Bullies,BIG BULLY,2
405, You had to ask.,The One With the Two Bullies,CHANDLER,2
406, Yeah.,The One With the Two Bullies,ROSS,2
408," Ok, ok look, see, the thing is we're, we're not gonna fight"", 'you guys.",The One With the Two Bullies, ROSS,2
409," Well then here's the deal, you won't have to so long as never ever show your"", 'faces in this coffee house ever again.",The One With the Two Bullies,LITTLE BULLY,2
410, I think you played the Gunther card too soon.,The One With the Two Bullies,CHANDLER,2
412," Hey Phoeb's, I think you're good to go.",The One With the Two Bullies,JOEY,2
413," Yeah, I don't know.",The One With the Two Bullies,PHOEBE,2
414, What's the matter?,The One With the Two Bullies,RACHEL,2
415," I just think that this was a really bad sign, ya know. I mean, like the beast at', ""the threshold, you know. It's just like, I have no family left, ya know. I mean except for"", ""my grandmother, you know, but let's face it, she's not gonna be around forever, despite"", ""what she says. And I have a sister who I've barely spoken to since we like shared a womb."", ""I don't know, this is my real father and I just, I want things to be like just right.",The One With the Two Bullies,PHOEBE,2
416," Yeah Phoebe, I completely understand.",The One With the Two Bullies,RACHEL,2
417," Yeah, whatever you need. Hey, you wanna go home?",The One With the Two Bullies,JOEY,2
418," Ok, thanks. Sorry, again",The One With the Two Bullies,PHOEBE,2
420, innocently What was that?,The One With the Two Bullies, PHOEBE,2
421," Uhh, I'm guessing the threshold's clear now.",The One With the Two Bullies,JOEY,2
423," I wanna buy 5 shares of SGJ and I wanna buy them now. C'mon"", 'time is money my friend. Thank you. Wooo.",The One With the Two Bullies,MONICA,2
424, Time is money my friend?,The One With the Two Bullies,RACHEL,2
425," Yeah, you missed, 'Takes money to make money,' and uh, 'Don't make me come down"", ""there and kick your wall street butt.'",The One With the Two Bullies,JOEY,2
426," Hey, I made $17 before breakfast, what have you done?",The One With the Two Bullies, MONICA,2
427," Well uh, I had breakfast here so technically I saved $3.50.",The One With the Two Bullies,JOEY,2
428, How did you make $17.,The One With the Two Bullies,RACHEL,2
429," Well, my financially challenged friends,  I split my money', 'and I bought some shares of CHP and ZXY.",The One With the Two Bullies,MONICA,2
430, How come those?,The One With the Two Bullies,JOEY,2
431," Well, CHP because I used to have a crush on Eric Estrada. And ZXY becuase I think', 'it sounds zexy.",The One With the Two Bullies,MONICA,2
432," What happened to uh, MEG.?",The One With the Two Bullies,RACHEL,2
433," MEG was good for me but I dumped her. Ya know, my motto is', 'get out before they go down.",The One With the Two Bullies, MONICA,2
434, That is so not my motto.,The One With the Two Bullies,JOEY,2
435, enters Hey.,The One With the Two Bullies,PHOEBE,2
436," Hey Phoebs. Oh hey, how's the dog?",The One With the Two Bullies,RACHEL,2
437," Ok, I talked to the vet, people are so nice upstate. Anyway, he said that the', ""little fella's gonna be ok and I can pick him up tomorrow.",The One With the Two Bullies,PHOEBE,2
438, Good.,The One With the Two Bullies,JOEY,2
439," Oh, thank God.",The One With the Two Bullies,RACHEL,2
440," Yeah, but he did have to have a bunch of stitches and he', ""said that only once in a blue moon does a dog's ear grow back so...still hoping.",The One With the Two Bullies, PHOEBE,2
441," Ok, so Phoebe, now are you gonna call your dad and let him know that his dog is', 'ok?",The One With the Two Bullies,RACHEL,2
442," I, I don't wanna meet my father over the phone.  What am I"", ""gonna say, like 'Hi, I'm Phoebe, the daughter you abandoned. Oh, by the way, I broke your"", ""dog.'",The One With the Two Bullies,PHOEBE,2
443," Hey Phoebs, if you want, I'll do it.",The One With the Two Bullies,JOEY,2
444," Ok. Listen, just don't say anything about me, ok. goes over and grabs the phone"", ""that's sitting by Monica",The One With the Two Bullies,PHOEBE,2
445, DON'T...be too long with the phone.,The One With the Two Bullies, MONICA,2
446, She'll be a much better friend when the market closes.,The One With the Two Bullies,RACHEL,2
447, dials the phone It's a woman.,The One With the Two Bullies,JOEY,2
448, So talk to her.,The One With the Two Bullies,PHOEBE,2
449," in a fake voice Uhh, hello Miss Buffay. I know where your', ""dog is. I want you to know that he'll be returned to you, almost as good as new, within,"", 'within 24 hours. Uh, goodbye. hangs up",The One With the Two Bullies, JOEY,2
450, Why the voice.,The One With the Two Bullies,RACHEL,2
451, in the voice Hard to say.,The One With the Two Bullies,JOEY,2
453, Your cappucino sir.,The One With the Two Bullies,CHANDLER,2
454, Thank you.,The One With the Two Bullies,ROSS,2
456, Ya know I think this is much better than the coffee house.,The One With the Two Bullies,CHANDLER,2
457, Absolutely.,The One With the Two Bullies,ROSS,2
459, How come it's not mixing with the water?,The One With the Two Bullies, ROSS,2
460,"Well the package says you have to uh, constantly keep it moving. Stir and drink,', 'stir and drink, never let it settle.",The One With the Two Bullies,CHANDLER,2
462," walks out of his room Hey, this is ridiculous. I'll tell you what. After I get"", ""back from my neice's christening, I'll go down to the coffee house with you and we'll all"", ""have a nice cup of coffee alright. No problem, Joey's there.",The One With the Two Bullies,JOEY,2
463, Ok.,The One With the Two Bullies,CHANDLER,2
464, No.,The One With the Two Bullies,ROSS,2
465, No?,The One With the Two Bullies,CHANDLER,2
466," No. Man I don't wanna have to have Joey with me every time I"", ""wanna descent cup of coffee. Ya know, and I don't wanna spend the rest of my life drinking"", ""cappucino with a 'K'. I say you and I go back down there and stand up to those guys.",The One With the Two Bullies, ROSS,2
467," Alright, hang on a second there Custer.",The One With the Two Bullies,CHANDLER,2
468," Yeah really, Ross, have you ever been beaten up before?",The One With the Two Bullies,JOEY,2
469," Yeah, sure.",The One With the Two Bullies,ROSS,2
470, By someone besides Monica?,The One With the Two Bullies,JOEY,2
471," No. So what. So what if we get beaten up, maybe that's just"", 'something every man has to go through once in his life. Ya know, like a, like a right of', ""passage or somethin'.",The One With the Two Bullies, ROSS,2
472," Well, couldn't we just lose our virginities again? Ya know, because I think"", ""actually mine's growing back.",The One With the Two Bullies,CHANDLER,2
474, Opens the door I need to borrow a hundred bucks.,The One With the Two Bullies,MONICA,2
475, What?,The One With the Two Bullies,RACHEL,2
476," Hi, welcome home. pulls Rachel inside I need to borrow a hundred bucks.",The One With the Two Bullies,MONICA,2
477, For what?,The One With the Two Bullies,RACHEL,2
478, I've gotta get back in the game.,The One With the Two Bullies,MONICA,2
479," Why, when did you get out of the game?",The One With the Two Bullies,RACHEL,2
480," I don't know, I lost it all ok. I lost it.",The One With the Two Bullies,MONICA,2
481, Oh no.,The One With the Two Bullies,RACHEL,2
482," Hey, I've come to terms with it, you have to too.",The One With the Two Bullies,MONICA,2
483," Ok. Look uhh, Mon I'm, I'm really sorry.",The One With the Two Bullies,RACHEL,2
484," Yeah, yeah, yeah, where are we on the hundred bucks?",The One With the Two Bullies,MONICA,2
485," I, I don't have it.",The One With the Two Bullies,RACHEL,2
486," But I need it. Otherwords I'm gonna have to take that"", ""horrible diner job. You know, with the dancing and the costumes. I don't wanna have to"", 'wear flame retardant boobs.",The One With the Two Bullies, MONICA,2
487, Nobody does honey.,The One With the Two Bullies,RACHEL,2
489, Hi.,The One With the Two Bullies,PHOEBE,2
490," Schnoodle. Oh my God, what the hell happened to my dog?",The One With the Two Bullies, MRS BUFFAY,2
491," It was an accident, and, and the woman who did this would never ever hurt a dog on', ""purpose. She's a vegetarian.",The One With the Two Bullies,PHOEBE,2
492," What are these, stitches?",The One With the Two Bullies,MRS BUFFAY,2
493," Yeah, eight of them. That's 56 to him. You know also, if, if it's raining, you"", ""can't let him look up too long 'cause that cone'll fill up really really fast.",The One With the Two Bullies,PHOEBE,2
494," Yeah well, thanks for bringing back what's left of him.",The One With the Two Bullies,MRS BUFFAY,2
495," Sure, oh, is, is Frank home.",The One With the Two Bullies,PHOEBE,2
496, How do you know Frank?,The One With the Two Bullies,MRS BUFFAY,2
497," Just from a, from a long time ago. Is he here?",The One With the Two Bullies,PHOEBE,2
498, Yeah. Frank.,The One With the Two Bullies,MRS BUFFAY,2
499, Yeah. What? a young guy comes around the corner,The One With the Two Bullies,FRANK,2
500," Oh, ok, um, I mean Frank senior.",The One With the Two Bullies, PHOEBE,2
501, He went out for groceries.,The One With the Two Bullies,MRS BUFFAY,2
502, Ok so will he be back soon?,The One With the Two Bullies,PHOEBE,2
503, Well he left four years ago so we're expecting him back any minute now.,The One With the Two Bullies,MRS BUFFAY,2
504," Alright, I'm, I'm gonna go. I'm sorry about the dog, everything. I'm sorry.",The One With the Two Bullies,PHOEBE,2
506, Hey lady. Hey wait up. How do you know my dad?,The One With the Two Bullies,FRANK,2
507, Um well I don't really. Just genetically. He's kinda my dad too.,The One With the Two Bullies,PHOEBE,2
508, Heavy.,The One With the Two Bullies,FRANK,2
509," Yeah. So um, did he ever talk about me, Phoebe?",The One With the Two Bullies,PHOEBE,2
510, No but he didn't really talk about anything.,The One With the Two Bullies,FRANK,2
511, Oh.,The One With the Two Bullies,PHOEBE,2
512, Except stilts.,The One With the Two Bullies,FRANK,2
513, Stilts?,The One With the Two Bullies,PHOEBE,2
514," Yeah, he loved stilts. One time I was upstairs, I was stealing cigarettes out of my', ""mom's purse, and uh, all of a sudden I look over and there's my dad's head bobbing past"", ""the window. He just had this big smile on his face and he was waving 'cause he was always"", 'happiest when he was on his stilts.",The One With the Two Bullies,FRANK,2
515, Wow.,The One With the Two Bullies,PHOEBE,2
516, Yeah.,The One With the Two Bullies,FRANK,2
517, I don't know what to do with that.,The One With the Two Bullies,PHOEBE,2
518, Me neither. So you're like my big sister.,The One With the Two Bullies, FRANK,2
519, Yeah.,The One With the Two Bullies,PHOEBE,2
520," This is huge, you can buy me beer.",The One With the Two Bullies,FRANK,2
521," I'm not gonna. But you know what's cool though? Ok, if you had a friend named"", ""Pete, then I could say, 'Oh yeah, I know Pete, he's friends with my brother.'",The One With the Two Bullies,PHOEBE,2
522, I gotta friend named Mark.,The One With the Two Bullies,FRANK,2
523, That'll work too.,The One With the Two Bullies,PHOEBE,2
524," Cool, alright. So maybe, ya know, I could give you a call sometime, we could talk', ""or somethin'.",The One With the Two Bullies,FRANK,2
525," Yeah, that'd be ok.",The One With the Two Bullies,PHOEBE,2
526, Alright.,The One With the Two Bullies,FRANK,2
527," Ok, I'm in the book.",The One With the Two Bullies,PHOEBE,2
528," Ok, yeah.",The One With the Two Bullies,FRANK,2
529," Alright. So um, stilts huh?",The One With the Two Bullies,PHOEBE,2
530," Yeah hey, you know if you want I can take you around back and show you where he hit', 'his head on the rain gutter.",The One With the Two Bullies,FRANK,2
531, Ok.,The One With the Two Bullies,PHOEBE,2
533," Well we did it, we're here. We are standing our ground. How"", 'long does a cup of coffee take?",The One With the Two Bullies, ROSS,2
534, Would you come on! Come on! waitress brings their coffee Thank you.,The One With the Two Bullies,CHANDLER,2
536," Ah, there we go.",The One With the Two Bullies,CHANDLER,2
537, I think we proved our point.,The One With the Two Bullies,ROSS,2
538, You burn your mouth?,The One With the Two Bullies,CHANDLER,2
539, Cannot feel my tounge.,The One With the Two Bullies,ROSS,2
541," Bullies, big bullies.",The One With the Two Bullies, CHANDLER,2
542," Oh, look who's here, it's the weenies.",The One With the Two Bullies,LITTLE BULLY,2
543, Did we not make ourselves clear the other day.,The One With the Two Bullies,BIG BULLY,2
544," Yes, and that's why we're here.",The One With the Two Bullies,ROSS,2
545," Yes, we're standing out ground...apparently.",The One With the Two Bullies,CHANDLER,2
546, Let's do this alright.,The One With the Two Bullies,LITTLE BULLY,2
547," Woah, ho-ho, whad'ya got there, a weapon?",The One With the Two Bullies,ROSS,2
548," It's a nice watch, I don't wanna break it on your ribs.",The One With the Two Bullies,LITTLE BULLY,2
549," Alright, let's do this.",The One With the Two Bullies,CHANDLER,2
550, Alright.,The One With the Two Bullies,LITTLE BULLY,2
552," Question. If I don't care about my watch, can I use it as a weapon?",The One With the Two Bullies,CHANDLER,2
553, Whad'ya mean?,The One With the Two Bullies,ROSS,2
554," Well, it's sharp, it's metal, I think I can do some, you know, serious damage"", 'with it.",The One With the Two Bullies,CHANDLER,2
555," No, you can't use your watch.",The One With the Two Bullies,BIG BULLY,2
556, Ok. reaches in his pocket,The One With the Two Bullies,CHANDLER,2
557, Or your keys.,The One With the Two Bullies,BIG BULLY,2
558, Ok.,The One With the Two Bullies,CHANDLER,2
559," Look, here's what we'll do. We'll put all keys and watches in the hat over"", 'there. Alright. they all put their keys and watches in the hat and put it on a mail box', ""Alright, c'mon man, let's do this.",The One With the Two Bullies,LITTLE BULLY,2
561," Before I forget, are we hitting faces?",The One With the Two Bullies,ROSS,2
562," Of course we're hitting faces, why wouldn't you hit faces?",The One With the Two Bullies,BIG BULLY,2
563," Well because I have to work on Monday, I have a big presentation.",The One With the Two Bullies,ROSS,2
564," Actually, you know, uh, I gotta show this apartment tomorrow and uh, you', 'know, this no faces thing might not be a bad idea.",The One With the Two Bullies,LITTLE BULLY,2
565," Ok, nothing from the neck up. everyone gets ready for the fight Or the waist', ""down. Dana's ovulating.",The One With the Two Bullies,BIG BULLY,2
566," Oh really, you guys tryin' again?",The One With the Two Bullies,LITTLE BULLY,2
567, Yeah.,The One With the Two Bullies,BIG BULLY,2
