,Characters,Dialogue,Test,Movie,Gender,length
0,PADME,Cordé...,True,Attack of the Clones,Female,1
1,CORDÉ,... I'm sorry m'lady... I'm... not sure I... ,True,Attack of the Clones,Female,8
2,AMIDALA,No!... No!... No!...,True,Attack of the Clones,Female,3
3,AMIDALA,I should not have come back.,True,Attack of the Clones,Female,6
4,CAPTAIN TYPHO,M'Lady you are still in danger.,True,Attack of the Clones,Male,6
5,CAPTAIN TYPHO,This vote is very important. You did your duty and Cordé did hers. Now come.  M'Lady please!,True,Attack of the Clones,Male,17
6,MAS AMEDDA,Order! We shall have order! The motion for the Republic to commission an army takes precedent and that is what we will vote on at this time.,True,Attack of the Clones,Male,27
7,PALPATINE,...My esteemed colleagues excuse me... I have just received some tragic and disturbing news. Senator Amidala of the Naboo system... Has been assassinated!,True,Attack of the Clones,Male,23
8,PALPATINE, This grievous blow is especially personal to me. Before I became Chancellor I served Amidala when she was Queen. She was a great leader who fought for justice not only in this honourable assembly but also on her home planet. She was so loved she could have been elected queen for life. She believed in public service and she fervently believed in democracy. Her death is a great loss to us all. We will all mourn her as a relentless champion of freedom... and as a dear friend.,True,Attack of the Clones,Male,88
9,SENATOR ASK AAK,How many more Senators will die before this civil strife ends! We must confront these rebels now and they need an army to do it.,True,Attack of the Clones,Male,25
10,AMBASSADOR DARSANA,Why weren't the Jedi able to stop this assassination? We are no longer safe under their protection.,True,Attack of the Clones,Male,17
11,ORN FREE TAA,The Republic needs more security now! Before it comes to war.,True,Attack of the Clones,Male,11
12,PALPATINE,Must I remind the Senator from Malastare that negotiations are continuing with the separatists. Peace is our objective here... not war.,True,Attack of the Clones,Male,21
13,AMIDALA,My noble colleagues I concur with the Supreme Chancellor. At all costs we do not want war!,True,Attack of the Clones,Female,17
14,PALPATINE,It is with great surprise and joy the chair recognises the Senator from Naboo Padmé Amidala.,True,Attack of the Clones,Male,16
15,PADME,Less than an hour ago an assassination attempt was made against my life. One of my bodyguards and six  others were ruthlessly and senselessly murdered. I was the target but more importantly I believe this security measure before you was the target. I have led the opposition to build an army... but there is someone in this body who will stop at nothing to assure it's passage...,True,Attack of the Clones,Female,67
16,PADME,  I warn you if you vote to create this army war will follow. I have experienced the misery of war  first-hand; I do not wish to do it again.,True,Attack of the Clones,Female,29
17,PADME,Wake up Senators... you must wake up! If you offer the separatists violence they can only show us violence in return! Many will lose their lives. All will lose their freedom. This decision could very well destroy the very foundation of our great Republic. I pray you do not let fear push you into a disastrous decision. Vote down this security measure which is nothing less than a declaration of war! Does anyone here want that? I cannot believe they do.,True,Attack of the Clones,Female,81
18,ORN FREE TAA,My motion to defer the vote must be dealt with first. That is the rule of law.,True,Attack of the Clones,Male,17
19,PALPATINE,Due to the lateness of the hour and the seriousness of this motion we will take up these matters tomorrow. Until then the Senate stands adjourned.,True,Attack of the Clones,Male,26
20,PALPATINE,I don't know how much longer I can hold off the vote my friends. More and more star systems are joining the separatists.,True,Attack of the Clones,Male,23
21,MACE WINDU ,If they do break away -,True,Attack of the Clones,,6
22,PALPATINE,No! I will not let that happen!,True,Attack of the Clones,Male,7
23,MACE WINDU ,But if they do you must realise there aren't enough Jedi to protect the Republic. We are keepers of the peace not soldiers.,True,Attack of the Clones,,23
24,PALPATINE,Master Yoda do you think it will really come to war?,True,Attack of the Clones,Male,11
25,YODA,Worse than war I fear... Much worse. ,True,Attack of the Clones,Male,7
26,PALPATINE,What?,True,Attack of the Clones,Male,1
27,MACE WINDU ,What do you sense Master?,True,Attack of the Clones,,5
28,YODA,Impossible to see ... The Dark Side clouds everything. But this I am sure of -  Do their duty the Jedi will.,True,Attack of the Clones,Male,22
29,DAR WAC,The loyalist committee has arrived my Lord. ,True,Attack of the Clones,Male,7
30,PALPATINE,Send them in.,True,Attack of the Clones,Male,3
31,YODA,With you the force is strong... young Senator. To see you alive brings warm feeling to my heart.,True,Attack of the Clones,Male,18
32,PADME,Thank you Master Yoda. Do you have any idea who was behind the attack?,True,Attack of the Clones,Female,14
33,MACE WINDU ,Our intelligence points to disgruntled spice miners on the moons of Naboo.,True,Attack of the Clones,,12
34,PADME,I don't wish to disagree but I think that Count Dooku was behind it.,True,Attack of the Clones,Female,14
35,MACE WINDU ,You know M'Lady Count Dooku was once a Jedi. He wouldn't assassinate anyone it is not in his character.,True,Attack of the Clones,,19
36,KI-ADI-MUNDI,He is a political idealist not a murderer.,True,Attack of the Clones,Male,8
37,YODA,In dark times nothing is what it appears to be but the fact remains Senator in grave danger you are.,True,Attack of the Clones,Male,20
38,PALPATINE,Count Dooku has always avoided any kind of conflict. It appears he has no desire to start a war. Why would he kill you? To what end?,True,Attack of the Clones,Male,27
39,PADME,I don't know but everything in my being tells me he was behind it... ,True,Attack of the Clones,Female,14
40,PALPATINE,Master Jedi may I suggest that the Senator be placed under the protection of your graces.,True,Attack of the Clones,Male,16
41,BAIL ORGANA,Do you think that is a wise use of manpower during these stressful times?,True,Attack of the Clones,Male,14
42,PADME,Chancellor if I may comment I do not believe the...,True,Attack of the Clones,Female,10
43,PALPATINE,"...""situation is that serious."" No but I do Senator.",True,Attack of the Clones,Male,9
44,PADME,Chancellor please! I don't want any more guards!,True,Attack of the Clones,Female,8
45,PALPATINE,I realise all too well that additional security might be disruptive for you but perhaps someone you are familiar with... an old friend like... Master Kenobi...,True,Attack of the Clones,Male,26
46,MACE WINDU ,That's possible. He has just returned from a Border dispute on Ansion.,True,Attack of the Clones,,12
47,PALPATINE,You must remember him M'Lady... he watched over you during the blockade conflict.,True,Attack of the Clones,Male,13
48,PADME,This is not necessary Chancellor.,True,Attack of the Clones,Female,5
49,PALPATINE,Do it for me M'Lady please. I will rest easier. We had a big scare today. The thought of losing you is unbearable.,True,Attack of the Clones,Male,23
50,MACE WINDU ,I will have Obi-Wan report to you immediately M'Lady.,True,Attack of the Clones,,9
51,YODA,Too little about yourself you worry Senator and too much about politics. Be mindful of your danger Padmé. Accept our help.,True,Attack of the Clones,Male,21
52,PALPATINE,I will not like this Republiv that has stood for over a thousand years be split in two,True,Attack of the Clones,Male,18
53,JAR JAR,Obi! Obi! Obi! Mesa sooo smilen to see'en yousa. Wahoooooo!,True,Attack of the Clones,Male,10
54,OBI-WAN,It's Good to see you too Jar Jar.,True,Attack of the Clones,Male,8
55,JAR JAR,Oops! Wheresa mesa manners? Excuse me Master Obi-Wan. I completely forgot myself for a moment there. I have had to learn Diplodiaclect... speak it like a native now. Don't really see the point actually but members of the Senate seem to prefer it...,True,Attack of the Clones,Male,43
56,JAR JAR, Nooooooo! Yousa so biggen! Yiyiyiyyi! Annie!! Mesa no believen.,True,Attack of the Clones,Male,9
57,ANAKIN,Hi Jar Jar.,True,Attack of the Clones,Male,3
58,JAR JAR,Annie! Annie! Yiyiyiyiyiyiiii!,True,Attack of the Clones,Male,3
59,JAR JAR,Lookie... lookie... Oops!... Oh dear I'm afraid I've forgotten myself again.,True,Attack of the Clones,Male,11
60,OBI-WAN,It's a great pleasure to see you again M'Lady.,True,Attack of the Clones,Male,9
61,PADME,It has been far too long Master Kenobi. I'm so glad our paths have crossed again... but I must warn you that I think your presence here is unnecessary.,True,Attack of the Clones,Female,29
62,OBI-WAN,I'm sure the Jedi Council have their reasons.,True,Attack of the Clones,Male,8
63,PADME,Annie??  My goodness you've grown.,True,Attack of the Clones,Female,5
64,ANAKIN, So have you... grown more beautiful I mean... and much shorter... for a Senator I mean.,True,Attack of the Clones,Male,16
65,PADME,Oh Annie you'll always be that little boy I knew on Tatooine.,True,Attack of the Clones,Female,12
66,OBI-WAN,Our presence will be invisible M'Lady.,True,Attack of the Clones,Male,6
67,CAPTAIN TYPHO,I am very grateful you are here Master Kenobi. The situation is more dangerous than the Senator will admit.,True,Attack of the Clones,Male,19
68,PADME,I don't need more security I need answers. I want to know who is trying to kill me.,True,Attack of the Clones,Female,18
69,OBI-WAN, We're here to protect you Senator not to start an investigation.,True,Attack of the Clones,Male,11
70,ANAKIN,We will find out who is trying to kill you Padmé I promise you.,True,Attack of the Clones,Male,14
71,OBI-WAN,We are not going to exceed our mandate my young Padawan learner.,True,Attack of the Clones,Male,12
72,ANAKIN,I meant in the interest of protecting her Master of course.,True,Attack of the Clones,Male,11
73,OBI-WAN,We are not going through this exercise again Anakin. You will pay attention to my lead.,True,Attack of the Clones,Male,16
74,ANAKIN,Why?,True,Attack of the Clones,Male,1
75,OBI-WAN,What??!!,True,Attack of the Clones,Male,1
76,ANAKIN,Why else do you think we were assigned to her if not to find the killer? Protection is a job for local security... not Jedi. It's overkill Master. Investigation is implied in our mandate.,True,Attack of the Clones,Male,34
77,OBI-WAN,We will do as the Council has instructed and you will learn your place young one.,True,Attack of the Clones,Male,16
78,PADME,Perhaps with merely your presence the mysteries surrounding this threat will be revealed.  Now if you will excuse me I will retire.,True,Attack of the Clones,Female,22
79,CAPTAIN TYPHO,Well I know I feel a lot better having you here. I'll have an officer on every floor and I'll be at the command centre downstairs.,True,Attack of the Clones,Male,26
80,JAR JAR,Mesa busten wit happiness seein Yousa again Annie. Deesa bad times bombad times.,True,Attack of the Clones,Male,13
81,ANAKIN,She didn't even recognise me Jar Jar. I thought about her every day since we parted... and she's forgotten me completely.,True,Attack of the Clones,Male,21
82,JAR JAR,Shesa happy. Happier den mesa see-en her in longo time.,True,Attack of the Clones,Male,10
83,OBI-WAN,Anakin you're focusing on the Negative again. Be mindful of your thoughts. She was glad to see us. Now lets check the security here.,True,Attack of the Clones,Male,24
84,ANAKIN,Yes my master.,True,Attack of the Clones,Male,3
85,MACE WINDU ,Why couldn't we see this attack on the Senator?,True,Attack of the Clones,,9
86,YODA,Masking the future is this disturbance in the Force.,True,Attack of the Clones,Male,9
87,MACE WINDU ,The propecy is coming true the Dark Side is growing.,True,Attack of the Clones,,10
88,YODA,And only those who have turned to the Dark Side can sense the possibilities of the future. Only going through the Dark Side can we see.,True,Attack of the Clones,Male,26
89,MACE WINDU ,It's been ten years and the Sith still have no shown themselves. Do you think they are behind this?,True,Attack of the Clones,,19
90,YODA,...Out there they are. A certainty that is.,True,Attack of the Clones,Male,8
91,MACE WINDU ,Do you think Obi-Wan's apprentice will be able to bring balance to the Force?,True,Attack of the Clones,,14
92,YODA,Only if he chooses to follow his destiny.,True,Attack of the Clones,Male,8
93,OBI-WAN,Captain Typho has more than enough men downstairs. No assassin will try that way. Any activity up here?,True,Attack of the Clones,Male,18
94,ANAKIN,Quiet as a tomb. I don't like just waiting here for something to happen to her.,True,Attack of the Clones,Male,16
95,OBI-WAN,What's going on?,True,Attack of the Clones,Male,3
96,ANAKIN,She covered that camera. I don't think she liked me watching her.,True,Attack of the Clones,Male,12
97,OBI-WAN,What is she thinking?,True,Attack of the Clones,Male,4
98,ANAKIN,She programmed Artoo to warn us if there's an intruder.,True,Attack of the Clones,Male,10
99,OBI-WAN,It's not an intruder I'm worried about. There are many other ways to kill a Senator.,True,Attack of the Clones,Male,16
100,ANAKIN,I know but we also want to catch this assassin. Don't we Master?,True,Attack of the Clones,Male,13
101,OBI-WAN,You're using her as bait??,True,Attack of the Clones,Male,5
102,ANAKIN,It was her idea... No harm will come to her. I can sense everything going on in that room. Trust me.,True,Attack of the Clones,Male,21
103,OBI-WAN,It's too risky... and your senses aren't that attuned young apprentice.,True,Attack of the Clones,Male,11
104,ANAKIN,And yours are?,True,Attack of the Clones,Male,3
105,OBI-WAN,Possibly.,True,Attack of the Clones,Male,1
106,OBI-WAN,You look tired.,True,Attack of the Clones,Male,3
107,ANAKIN,I don't sleep well anymore.,True,Attack of the Clones,Male,5
108,OBI-WAN,Because of your mother?,True,Attack of the Clones,Male,4
109,ANAKIN,I don't know why I keep dreaming About her now. I haven't seen her since I was little.,True,Attack of the Clones,Male,18
110,OBI-WAN,Dreams pass in time.,True,Attack of the Clones,Male,4
111,ANAKIN,I'd rather dream of Padmé. Just Being around her again is... intoxicating.,True,Attack of the Clones,Male,12
112,OBI-WAN,Mind your thoughts Anakin they betray you. You've made a commitment to the Jedi order... a commitment not easily broken... and don't forget she's a politician. They're not to be trusted.,True,Attack of the Clones,Male,31
113,ANAKIN,She's not like the others in the Senate Master.,True,Attack of the Clones,Male,9
114,OBI-WAN,It's been my experience that Senators are only focused on pleasing those who fund their campaigns... and they are more than willing to forget the niceties of democracy to get those funds.,True,Attack of the Clones,Male,32
115,ANAKIN,Not another lecture Master. Not on the economics of politics.... It's too early in the morning... and besides you're generalising. The Chancellor doesn't appear to be corrupt.,True,Attack of the Clones,Male,27
116,OBI-WAN,Palpatine's a politician I've observed that he is very clever at following the passions and prejudices of the Senators.,True,Attack of the Clones,Male,19
117,ANAKIN,I think he is a good man. My instincts are very positive about...,True,Attack of the Clones,Male,13
118,OBI-WAN,I sense it too.,True,Attack of the Clones,Male,4
119,ANAKIN,Stay here!,True,Attack of the Clones,Male,2
120,OBI-WAN,I have a bad feeling about this.,True,Attack of the Clones,Male,7
121,ANAKIN,That was wacky! I almost lost you in the traffic.,True,Attack of the Clones,Male,10
122,OBI-WAN,What took you so long?,True,Attack of the Clones,Male,5
123,ANAKIN,Oh you know Master I couldn't find a speeder I really liked with an open cockpit... and with the right speed capabilities... and then you know I had to get a really gonzo color...,True,Attack of the Clones,Male,34
124,OBI-WAN,If you'd spend as much time working on your saber skills as you do on your wit young Padawan you would rival Master Yoda as a swordsman.,True,Attack of the Clones,Male,27
125,ANAKIN,I thought I already did.,True,Attack of the Clones,Male,5
126,OBI-WAN,Only in your mind my very young apprentice. Careful!! Hey easy!!,True,Attack of the Clones,Male,11
127,ANAKIN,Sorry I forgot you don't like flying Master.,True,Attack of the Clones,Male,8
128,OBI-WAN,I don't mind flying... but what you're doing is suicide!,True,Attack of the Clones,Male,10
129,ANAKIN,Master you know I've been flying since before I could walk. I'm very good at this.,True,Attack of the Clones,Male,16
130,OBI-WAN,Just slow down!,True,Attack of the Clones,Male,3
131,OBI-WAN, Wait! Don't go in there!,True,Attack of the Clones,Male,5
132,OBI-WAN, You know I don't like it when you do that!,True,Attack of the Clones,Male,10
133,ANAKIN,Sorry Master. Don't worry this guy's gonna kill himself any minute now!,True,Attack of the Clones,Male,12
134,OBI-WAN,What are you doing? He's gonna blast me!,True,Attack of the Clones,Male,8
135,ANAKIN,Right - this isn't working.,True,Attack of the Clones,Male,5
136,OBI-WAN,That was too close!,True,Attack of the Clones,Male,4
137,ANAKIN,Clear that!,True,Attack of the Clones,Male,2
138,OBI-WAN,What??,True,Attack of the Clones,Male,1
139,ANAKIN,Clear the flag! We're losing power! Hurry!,True,Attack of the Clones,Male,7
140,OBI-WAN,Whooooaaa! Don't do that! I don't  like it when you do that!,True,Attack of the Clones,Male,12
141,ANAKIN,So sorry Master.,True,Attack of the Clones,Male,3
142,OBI-WAN,It's dangerous near those power couplings! Slow down! Don't go through there!,True,Attack of the Clones,Male,12
143,OBI-WAN, Yiiii what are you doing?,True,Attack of the Clones,Male,5
144,ANAKIN,Sorry Master!,True,Attack of the Clones,Male,2
145,OBI-WAN, Oh that was good...,True,Attack of the Clones,Male,4
146,ANAKIN,That was crazy!!!,True,Attack of the Clones,Male,3
147,ANAKIN, Ahh damn.,True,Attack of the Clones,Male,2
148,OBI-WAN,Stop!!,True,Attack of the Clones,Male,1
149,ANAKIN,No we can make it.,True,Attack of the Clones,Male,5
150,OBI-WAN,I'm crazy... I'm crazy... I'm crazy.,True,Attack of the Clones,Male,6
151,ANAKIN,But it worked... we made it.,True,Attack of the Clones,Male,6
152,OBI-WAN, It didn't work... we've stalled! And you almost got us killed!,True,Attack of the Clones,Male,11
153,ANAKIN,I think we're still alive.,True,Attack of the Clones,Male,5
154,OBI-WAN, It was stupid!,True,Attack of the Clones,Male,3
155,ANAKIN, I could have made it...,True,Attack of the Clones,Male,5
156,OBI-WAN, But you didn't!!! And now we've lost him.,True,Attack of the Clones,Male,8
157,ANAKIN,No we didnt...,True,Attack of the Clones,Male,3
158,OBI-WAN,Where are you going?! He went down there the other way.,True,Attack of the Clones,Male,11
159,ANAKIN,This is a shortcut... I think.,True,Attack of the Clones,Male,6
160,OBI-WAN,What do you mean You think? What kind of shortcut?! He went completely the other way! Youve lost him!,True,Attack of the Clones,Male,19
161,ANAKIN,Master if we keep this chase going that creeps gonna end up deep fried. Personally Id very much like to find out who in the hell he is and who hes working for...,True,Attack of the Clones,Male,33
162,OBI-WAN, Oh so thats why were going in the wrong direction.,True,Attack of the Clones,Male,10
163,OBI-WAN, Well you lost him.,True,Attack of the Clones,Male,4
164,ANAKIN,Im deeply sorry Master.,True,Attack of the Clones,Male,4
165,ANAKIN, Excuse me for a moment.,True,Attack of the Clones,Male,5
166,OBI-WAN,Anakin!,True,Attack of the Clones,Male,1
167,ANAKIN,She went into that club Master.,True,Attack of the Clones,Male,6
168,OBI-WAN,Patience.,True,Attack of the Clones,Male,1
169,OBI-WAN,  Here. Next time try not to lose it.,True,Attack of the Clones,Male,8
170,ANAKIN,Sorry Master.,True,Attack of the Clones,Male,2
171,OBI-WAN,A Jedi's saber is his most precious possession.,True,Attack of the Clones,Male,8
172,ANAKIN,Yes Master.,True,Attack of the Clones,Male,2
173,OBI-WAN,He must keep it with him at all times.,True,Attack of the Clones,Male,9
174,ANAKIN,I know Master.,True,Attack of the Clones,Male,3
175,OBI-WAN,This weapon is your life!,True,Attack of the Clones,Male,5
176,ANAKIN,I've heard this lesson before...,True,Attack of the Clones,Male,5
177,OBI-WAN,But you haven't learned anything Anakin.,True,Attack of the Clones,Male,6
178,ANAKIN,I try Master.,True,Attack of the Clones,Male,3
179,OBI-WAN,Why do I think you are going to be the death of me?!,True,Attack of the Clones,Male,13
180,ANAKIN,Don't say that Master... You're the closest thing I have to a father... I love you. I don't want to cause you pain.,True,Attack of the Clones,Male,23
181,OBI-WAN,Then why don't you listen to me?!,True,Attack of the Clones,Male,7
182,ANAKIN,I will. I'll do better I promise.,True,Attack of the Clones,Male,7
183,OBI-WAN,Do you see him him?,True,Attack of the Clones,Male,5
184,ANAKIN,I think he's a she...,True,Attack of the Clones,Male,5
185,OBI-WAN,Then be extra careful...  Check it out.,True,Attack of the Clones,Male,7
186,ANAKIN,Where are you going Master?,True,Attack of the Clones,Male,5
187,OBI-WAN,To get a drink.,True,Attack of the Clones,Male,4
188,ELAN SLEAZEBAGGANO,Wanna buy some death sticks?,True,Attack of the Clones,,5
189,OBI-WAN,You don't want to sell me death- sticks.,True,Attack of the Clones,Male,8
190,ELAN,I don't want to sell you death- sticks.,True,Attack of the Clones,Male,8
191,OBI-WAN,You want to go home and rethink  your life.,True,Attack of the Clones,Male,9
192,ELAN,I want to go home and rethink my life.,True,Attack of the Clones,Male,9
193,ANAKIN,Easy... Official business. Go back to your drinks.,True,Attack of the Clones,Male,8
194,OBI-WAN,Do you know who it was you were trying to kill?,True,Attack of the Clones,Male,11
195,ZAM WESSEL,The Senator from Naboo.,True,Attack of the Clones,Female,4
196,OBI-WAN,Who hired you?,True,Attack of the Clones,Male,3
197,ZAM WESSEL,It was just a job.,True,Attack of the Clones,Female,5
198,ANAKIN,Tell us!,True,Attack of the Clones,Male,2
199,ZAM WESSEL,That Senator's gonna die soon anyway and the next one won't make the same mistake I did...,True,Attack of the Clones,Female,17
200,OBI-WAN,This wound's going to need treatment.,True,Attack of the Clones,Male,6
201,ANAKIN,Who hired you? Tell us... tell us now!,True,Attack of the Clones,Male,8
202,ZAM,It was a Bounty Hunter called...,True,Attack of the Clones,,6
203,OBI-WAN,Toxic Dart...,True,Attack of the Clones,Male,2
204,PADME,Representative Binks. I know I can count on you.,True,Attack of the Clones,Female,9
205,JAR JAR,Yousa betchen mesa bottums.,True,Attack of the Clones,Male,4
206,PADME,What?!,True,Attack of the Clones,Female,1
207,JAR JAR, It is not every day that I am called upon to...,True,Attack of the Clones,Male,11
208,PADME,You're a good friend Jar Jar. I don't wish to hold you up. I'm sure you have a great deal to do.,True,Attack of the Clones,Female,22
209,JAR JAR,Of course M'lady.,True,Attack of the Clones,Male,3
210,PADME,I do not like this idea of hiding.,True,Attack of the Clones,Female,8
211,ANAKIN,Don't worry. Now that the Council has ordered an investigation it won't take Master Obi-Wan long to find that bounty hunter.,True,Attack of the Clones,Male,21
212,PADME," I haven't worked for a year to defeat the ""Military Creation Act"" not to be here when its fate is decided.",True,Attack of the Clones,Female,21
213,ANAKIN,Sometimes we have to let go of our pride and do what is requested of us.,True,Attack of the Clones,Male,16
214,PADME,Pride?!? Annie you're young and you don't have a very firm grip on politics. I suggest you reserve your opinions for some other time.,True,Attack of the Clones,Female,24
215,ANAKIN,Sorry M'lady. I was only trying to...,True,Attack of the Clones,Male,7
216,PADME,Annie! No!,True,Attack of the Clones,Female,2
217,ANAKIN,Please don't call me that.,True,Attack of the Clones,Male,5
218,PADME,What?,True,Attack of the Clones,Female,1
219,ANAKIN,Annie...,True,Attack of the Clones,Male,1
220,PADME,I've always called you that... it is your name isn't it?,True,Attack of the Clones,Female,11
221,ANAKIN,It's Anakin. When you say Annie it's like I'm still a little boy... and I'm not.,True,Attack of the Clones,Male,16
222,PADME,I'm sorry Anakin. It's impossible to deny you've...  ...that you've grown up.,True,Attack of the Clones,Female,12
223,ANAKIN,Master Obi-Wan manages not to see it...,True,Attack of the Clones,Male,7
224,PADME,Mentors have a way of seeing more of our faults than we would like. It's the only way we grow.,True,Attack of the Clones,Female,20
225,ANAKIN,Don't get me wrong... Obi-Wan is a great mentor. As wise as Master Yoda and as powerful as Master Windu. I am truly thankful to be his apprentice. Only... although I'm a Padawan learner in some ways... a lot of ways... I'm ahead of him. I'm ready for the trials. I know I am! He knows it too. He believes I'm too unpredictable... Other Jedi my age have gone through the trials and made it... I know I started my training late... but he won't let me move on.,True,Attack of the Clones,Male,89
226,PADME,That must be frustrating.,True,Attack of the Clones,Female,4
227,ANAKIN,It's worse... he's overly critical. He never listens! He just doesn't understand! It's not fair!,True,Attack of the Clones,Male,15
228,PADME,I'm sorry... You sounded exactly like that little boy I once knew when he didn't get his way.,True,Attack of the Clones,Female,18
229,ANAKIN,I'm not whining! I'm not.,True,Attack of the Clones,Male,5
230,PADME,I didn't say it to hurt you.,True,Attack of the Clones,Female,7
231,ANAKIN,I know...,True,Attack of the Clones,Male,2
232,PADME,Anakin...,True,Attack of the Clones,Female,1
233,PADME, Don't try to grow up too fast.,True,Attack of the Clones,Female,7
234,ANAKIN,I am grown up. You said it yourself.,True,Attack of the Clones,Male,8
