,Characters,Dialogue,Test,Movie,Gender,length
447,PADME,When I was in Level Three we used to come here for school retreat. See that island? We used to swim there every day. I love the water.,True,Attack of the Clones,Female,28
448,ANAKIN,I do too. I guess it comes from growing up on a desert planet.,True,Attack of the Clones,Male,14
449,PADME,...We used to lie on the sand and let the sun dry us... and try to guess the names of the birds singing.,True,Attack of the Clones,Female,23
450,ANAKIN,I dont like sand. Its coarse and rough and irritating and it gets everywhere. Not like here. Here everythings soft... and smooth...,True,Attack of the Clones,Male,22
451,PADME,There was a very old man who lived on the island. He used to make glass out of sand - and vases and necklaces out of the glass. They were magical.,True,Attack of the Clones,Female,31
452,ANAKIN, Everything here is magical.,True,Attack of the Clones,Male,4
453,PADME,You could look into the glass and see the water. The way it ripples and moves. It looked so real... but it wasnt.,True,Attack of the Clones,Female,23
454,ANAKIN,Sometimes when you believe something to be real it becomes real. Real enough anyway...,True,Attack of the Clones,Male,14
455,PADME,I used to think if you looked too deeply into glass you would lose yourself.,True,Attack of the Clones,Female,15
456,ANAKIN,I think it's true...,True,Attack of the Clones,Male,4
457,PADME,I shouldn't have done that.,True,Attack of the Clones,Female,5
458,ANAKIN,I'm sorry. When I'm around you my mind is no longer my own.,True,Attack of the Clones,Male,13
459,PADME,It's the situation... the stress...,True,Attack of the Clones,Female,5
460,ANAKIN,...the view.,True,Attack of the Clones,Male,2
461,MACE WINDU ,Be wary this disturbance in the Force is growing stronger.,True,Attack of the Clones,,10
462,OBI-WAN,I am concerned for my Padawan. He is not ready to be on his own.,True,Attack of the Clones,Male,15
463,YODA,The Council is confident in this decision Obi-Wan.,True,Attack of the Clones,Male,8
464,MACE WINDU,He has exceptional skills. The Council is confident in its decision Obi-Wan. If the prophecy is true he weill be the one to bring balance to the Force.,True,Attack of the Clones,Male,28
465,OBI-WAN,But he still has much to learn. And his abilities have made him... well... arrogant. I realise now what you and Master Yoda knew from the beginning... the boy was too old to start the training and...,True,Attack of the Clones,Male,37
466,MACE WINDU ,There's something else?,True,Attack of the Clones,,3
467,OBI-WAN,Master he should not have been given this assignment. I'm afraid Anakin won't be able to protect the Senator. ,True,Attack of the Clones,Male,19
468,MACE WINDU ,Why?,True,Attack of the Clones,,1
469,OBI-WAN,He has a... an emotional connection with her. It's been there since he was boy. Now he's confused... distracted.,True,Attack of the Clones,Male,19
470,MACE WINDU ,Obi-Wan you must have faith that he will take the right path.,True,Attack of the Clones,,12
471,OBI-WAN,Has Master Yoda gained any insight into whether or not this war will come about?,True,Attack of the Clones,Male,15
472,MACE WINDU ,Probing the Dark Side is a dangerous process. He could be in seclusion for days... May the force be with you.,True,Attack of the Clones,,21
473,PADME,You did that?,True,Attack of the Clones,Female,3
474,ANAKIN,What?,True,Attack of the Clones,Male,1
475,PADME,That! Now stop it!,True,Attack of the Clones,Female,4
476,PADME, Anakin!!,True,Attack of the Clones,Female,1
477,ANAKIN,I'm not really supposed to do that... for fun I mean. If Master Obi-Wan were here he'd be very grumpy.,True,Attack of the Clones,Male,20
478,ANAKIN,May I tell you something?,True,Attack of the Clones,Male,5
479,PADME,I don't know.,True,Attack of the Clones,Female,3
480,ANAKIN,Then how can I tell you?,True,Attack of the Clones,Male,6
481,PADME,Maybe you should use your Jedi intuition.,True,Attack of the Clones,Female,7
482,ANAKIN,It doesn't work around you. My mind is always a muddle... I can only think of you.,True,Attack of the Clones,Male,17
483,PADME,Anakin don't...,True,Attack of the Clones,Female,2
484,ANAKIN,From the moment I met you all those years ago a day hasn't gone by when I haven't thought of you. And now that I'm close to you again I'm in agony. The closer I get to you the worse it gets. The thought of not being with you mskes my stomach turn over - my mouth goes dry. I feel dizzy. I can't breathe. I'm haunted by the kiss you should never have given me. My heart is beating hoping that kiss will not become a scar. You are in my very soul tormenting me. What can I do? I will do anything you ask...,True,Attack of the Clones,Male,106
485,ANAKIN, If you are suffering as much as I am tell me.,True,Attack of the Clones,Male,11
486,PADME,...I can't. We can't. It's just not possible.,True,Attack of the Clones,Female,8
487,ANAKIN,Anything's possible. Padme please listen...,True,Attack of the Clones,Male,5
488,PADME,You listen. We live in a real world. Come back to it. You're studying to become a Jedi Knight. I'm a Senator. If you follow your thoughts through to conclusion they will take us to a place we cannot go... regardless of the way we feel about each other.,True,Attack of the Clones,Female,49
489,ANAKIN,Then you do feel something! There's an extraordinary connection between us. You can't deny that.,True,Attack of the Clones,Male,15
490,PADME,Annie it doesn't make any difference. Jedi aren't allowed to marry. You swore an oath remember? You'd be expelled from the Order. I will not let you give up your responsibilities... your future for me.,True,Attack of the Clones,Female,35
491,ANAKIN,I was destined to be a Jedi. I don't think I could be anything else. But you are asking me to be rational. That is something I know I cannot do. I wish I could wish my feelings away... but I can't.,True,Attack of the Clones,Male,42
492,PADME,I am not going to give into this. I'm not going to throw my life away. I have more important things to do than fall in love.,True,Attack of the Clones,Female,27
493,ANAKIN,It wouldn't have to be that way... we could keep it a secret.,True,Attack of the Clones,Male,13
494,PADME,Then we'd be living a lie - one we couldn't keep even if we wanted to. Mt sister saw it. So did my mother. I couldn't do that. Could you Anakin? Could you live like that?,True,Attack of the Clones,Female,36
495,ANAKIN,...No you're right. It would destroy us.,True,Attack of the Clones,Male,7
496,TAUN WE,Welcome to Tipoca City Master Jedi.,True,Attack of the Clones,Female,6
497,TAUN WE,Everything is ready. The Prime Minister expects you.,True,Attack of the Clones,Female,8
498,OBI-WAN, I'm expected?,True,Attack of the Clones,Male,2
499,TAUN WE,Of course! He is anxious to see you. After all these years we were beginning to think you weren't coming. Now please this way!,True,Attack of the Clones,Female,24
500,TAUN WE,May I present Lama Su Prime Minister of Kamino... and this is Master Jedi...,True,Attack of the Clones,Female,14
501,OBI-WAN,Obi-Wan Kenobi.,True,Attack of the Clones,Male,2
502,LAMA SU,Please...,True,Attack of the Clones,Male,1
503,LAMA SU,I trust you are going to enjoy your stay. We are most happy you have arrived at the best part of the season.,True,Attack of the Clones,Male,23
504,OBI-WAN,You make me feel most welcome.,True,Attack of the Clones,Male,6
505,LAMA SU,And now to business. You will be delighted to hear we are on schedule. Two hundred thousand units are ready with another million well on the way.,True,Attack of the Clones,Male,27
506,OBI-WAN, That is... good news.,True,Attack of the Clones,Male,4
507,LAMA SU,Please tell your Master Sido-Dyas that we have every confidence his order will be met on time and in full. He is well I hope?,True,Attack of the Clones,Male,25
508,OBI-WAN,I'm sorry Master - ?,True,Attack of the Clones,Male,5
509,LAMA SU,Jedi Master Sifo-Dyas. He's still a leading member of the Jedi Council is he not?,True,Attack of the Clones,Male,15
510,OBI-WAN,Oh yes. Sido-Dyas.,True,Attack of the Clones,Male,3
511,LAMA SU, You must be anxious to inspect the units for yourself.,True,Attack of the Clones,Male,10
512,OBI-WAN,That's why I'm here.,True,Attack of the Clones,Male,4
513,PADME,I don't know...,True,Attack of the Clones,Female,3
514,ANAKIN,Sure you do... you just don't want to tell me.,True,Attack of the Clones,Male,10
515,PADME,Are you going to use one of your Jedi mind tricks on me?,True,Attack of the Clones,Female,13
516,ANAKIN,They only work on the weak-minded. You are anything but weak-minded.,True,Attack of the Clones,Male,11
517,PADME,All right... his name was Palo. I was twelve. We were both in the Legislative Youth Program. He was a few years older then I... very cute... dark curly hair... dreamy eyes.,True,Attack of the Clones,Female,32
518,ANAKIN,All right I get the picture... whatever happened to him?,True,Attack of the Clones,Male,10
519,PADME,I went on to become a Queen. He went on to become an artist.,True,Attack of the Clones,Female,14
520,ANAKIN,Maybe he was the smart one.,True,Attack of the Clones,Male,6
521,PADME,You really don't like politicians do you?,True,Attack of the Clones,Female,7
522,ANAKIN,I like two or three but I'm not really sure about one of them.  I don't think the system works.,True,Attack of the Clones,Male,20
523,PADME,How would you have it work?,True,Attack of the Clones,Female,6
524,ANAKIN,We need a system where the politicians sit down and discuss the problems agree what's in the best interests of all the people and then do it.,True,Attack of the Clones,Male,27
525,PADME,That is exactly what we do. The trouble is that people don't wlways agree. In fact they hardly ever do.,True,Attack of the Clones,Female,20
526,ANAKIN,Then they should be made to.,True,Attack of the Clones,Male,6
527,PADME,By whom? Who's going to make them?,True,Attack of the Clones,Female,7
528,ANAKIN,I don't know. Someone.,True,Attack of the Clones,Male,4
529,PADME,You?,True,Attack of the Clones,Female,1
530,ANAKIN,Of course not me.,True,Attack of the Clones,Male,4
531,PADME,But someone.,True,Attack of the Clones,Female,2
532,ANAKIN,Someone wise.,True,Attack of the Clones,Male,2
533,PADME,That sounds an awful lot like a dictatorship to me.,True,Attack of the Clones,Female,10
534,ANAKIN,Well if it works...,True,Attack of the Clones,Male,4
535,PADME,You're making fun of me.,True,Attack of the Clones,Female,5
536,ANAKIN,  On no I'd be much too frightened to tease a Senator.,True,Attack of the Clones,Male,11
537,PADME,You're so bad!,True,Attack of the Clones,Female,3
538,ANAKIN,You're always so serious. Always carrying the weight of the universe on your shoulders.,True,Attack of the Clones,Male,14
539,LAMA SU, Magnificent aren't they?,True,Attack of the Clones,Male,3
540,LAMA SU,We modified their genetic structure to make them less independent than the original host. As a result they are totally obedient taking any order without question.,True,Attack of the Clones,Male,26
541,OBI-WAN,Who was the original host?,True,Attack of the Clones,Male,5
542,LAMA SU,A bounty hunter called Jango Fett. We felt a Jedi would be the perfect choice but Sido-Dyas hand- picked Jango Fett himself.,True,Attack of the Clones,Male,22
543,OBI-WAN,Where is this bounty hunter now?,True,Attack of the Clones,Male,6
544,LAMA SU,Oh we keep him here. After a few hundred thousand clones the genetic pattern starts to fade so we take a fresh supply. He lives here but he's free to come and go as he pleases.,True,Attack of the Clones,Male,36
545,LAMA SU,Apart from his pay which is considerable Fett demanded only one thing - an unaltered clone for himself. Curious isn't it?,True,Attack of the Clones,Male,21
546,OBI-WAN,Unaltered?,True,Attack of the Clones,Male,1
547,LAMA SU,Pure genetic replication. No tampering with the structure to make it more docile... and no growth acceleration...,True,Attack of the Clones,Male,17
548,OBI-WAN,I would like to meet this Jango Fett.,True,Attack of the Clones,Male,8
549,TAUN WE,I would be most happy to arrange it for you.,True,Attack of the Clones,Female,10
550,OBI-WAN,You mentioned growth acceleration...,True,Attack of the Clones,Male,4
551,LAMA SU,Oh yes it's essential. Otherwise a mature clone would take a lifetime to grow. Now we can do it in half the time. Those items you saw on the parade ground were started ten years ago when Sido-dyas first placed the order and they're already mature...,True,Attack of the Clones,Male,46
552,OBI-WAN,And these?,True,Attack of the Clones,Male,2
553,LAMA SU,About five years ago.,True,Attack of the Clones,Male,4
554,LAMA SU,They're immensely superior to droids capable of independent thought and action.,True,Attack of the Clones,Male,11
555,OBI-WAN,Very impressive.,True,Attack of the Clones,Male,2
556,LAMA SU,I'd hoped you would be pleased. ,True,Attack of the Clones,Male,6
557,OBI-WAN, Tell me prime minister when my Master Sido-dyas first contacted you did he say the order was for... himself... or?,True,Attack of the Clones,Male,20
558,LAMA SU,Himself? Of course not. This army is for the Republic?,True,Attack of the Clones,Male,10
559,OBI-WAN, The Repubic?,True,Attack of the Clones,Male,2
560,LAMA SU,We are also very much agasint this Count Dooku and his seccessionist movement. We are proud to be of help to the Republic.,True,Attack of the Clones,Male,23
561,TAUN WE,I have arranged for you to meet Jango Fett in the morning. Sleep well.,True,Attack of the Clones,Female,14
562,OBI-WAN,Arfour Arfour...,True,Attack of the Clones,Male,2
563,OBI-WAN,"Arfour relay this ""scramble code five"" to Courscant: care of ""the old folks home.""",True,Attack of the Clones,Male,14
564,OBI-WAN (V.O.),...I've never heard of a Jedi called Sido-Dyas have you Master?,True,Attack of the Clones,Male,11
565,MACE WINDU ,No. Whoever placed that order was not a Jedi I can assure you.,True,Attack of the Clones,,13
566,OBI-WAN (V.O.),I have a strong feeling that this bounty hunter is the assassin we're looking for.,True,Attack of the Clones,Male,15
567,YODA,Who he is working for... discover that you must.,True,Attack of the Clones,Male,9
568,OBI-WAN (V.O.),I will Master and I will also find out more about this clone army... May The Force...,True,Attack of the Clones,Male,17
569,MACE WINDU,A clone army! Ordered by someone in the Senate perhaps... Someone's out to start a war.,True,Attack of the Clones,Male,16
570,YODA,Inform the chancellor of this we must.,True,Attack of the Clones,Male,7
571,MACE WINDU,Who do you think this impostor Sido-Dyas could be?,True,Attack of the Clones,Male,9
572,ANAKIN,No...No...No...Mom!...Don't no don't!,True,Attack of the Clones,Male,3
573,ANAKIN, Don't go.,True,Attack of the Clones,Male,2
574,PADME,I don't want to disturb you.,True,Attack of the Clones,Female,6
575,ANAKIN,Your presence is soothing.,True,Attack of the Clones,Male,4
576,PADME,You had a nightmare again last night.,True,Attack of the Clones,Female,7
577,ANAKIN,Jedi don't have nightmares.,True,Attack of the Clones,Male,4
578,PADME,I heard you.,True,Attack of the Clones,Female,3
579,ANAKIN,I saw my mother. I saw her as clearly as I see you now. She's suffering Padme. She is in pain...They're killing her!  I know I'm disobeying my mandate to protect you Senator. I know I will be punished and possibly thrown out of the Jedi Order but I must go. I have to help her! I'm sorry Padme. I don't have a choice.,True,Attack of the Clones,Male,64
580,PADME,Annie I told you I wouldn't let you give up your future for me. I'll go with you. That way you can continue to protect me and you won't be disobeying your mandate.,True,Attack of the Clones,Female,33
581,ANAKIN,What about Master Obi-wan?,True,Attack of the Clones,Male,4
582,PADME,I guess we won't tell him will we?,True,Attack of the Clones,Female,8
583,TAUN WE,Boba is your father here?,True,Attack of the Clones,Female,5
584,TAUN WE, May we see him?,True,Attack of the Clones,Female,4
585,BOBA FETT,Sure.,True,Attack of the Clones,Male,1
586,BOBA FETT,Dad! Taun We's here!,True,Attack of the Clones,Male,4
587,TAUN WE,Welcome back Jango. Was your trip productive?,True,Attack of the Clones,Female,7
588,JANGO FETT,Fairly.,True,Attack of the Clones,Male,1
589,TAUN WE,This is Jedi Master Obi-Wan Kenobi. He's come to check on our progress.,True,Attack of the Clones,Female,13
590,JANGO FETT,That right?,True,Attack of the Clones,Male,2
591,OBI-WAN,Your clones are very impressive. You must be very proud.,True,Attack of the Clones,Male,10
592,JANGO FETT,I'm just a simple man trying to make my way in the universe Master Jedi.,True,Attack of the Clones,Male,15
593,OBI-WAN,Aren't we all?,True,Attack of the Clones,Male,3
594,OBI-WAN, Ever made your way as far into the interior as Coruscant?,True,Attack of the Clones,Male,11
595,JANGO FETT,Once or twice.,True,Attack of the Clones,Male,3
596,OBI-WAN,Recently?,True,Attack of the Clones,Male,1
597,JANGO FETT, Possibly...,True,Attack of the Clones,Male,1
598,OBI-WAN,Then you must know Master Sido- Dyas?,True,Attack of the Clones,Male,7
599,JANGO FETT,Boba close the door.,True,Attack of the Clones,Male,4
600,JANGO FETT, Master who?,True,Attack of the Clones,Male,2
601,OBI-WAN,Sido-Dyas. Isnt he the Jedi who hired you for this job?,True,Attack of the Clones,Male,11
602,JANGO FETT,Never heard of him. I was recuited by a man called Darth Tyranus on one of the moons of Bogden.,True,Attack of the Clones,Male,20
603,OBI-WAN,No? I thought...,True,Attack of the Clones,Male,3
604,TAUN WE,Sido-Dyas told us to expect him. And he showed up just when your Jedi Master said he would. We have kept the Jedis involvement a secret until your arrival just as your Master requested.,True,Attack of the Clones,Female,34
605,OBI-WAN,Curious...,True,Attack of the Clones,Male,1
606,JANGO FETT,Do you like your army?,True,Attack of the Clones,Male,5
607,OBI-WAN,It seems to me it's your army - being that they are all clones of you.,True,Attack of the Clones,Male,16
608,JANGO FETT, They'll do their job well I'll guarantee that.,True,Attack of the Clones,Male,8
609,OBI-WAN,I look forward to seeing them in action. Thank you for your time Jango.,True,Attack of the Clones,Male,14
610,JANGO FETT,Always a pleasure to meet a Jedi.,True,Attack of the Clones,Male,7
611,BOBA,What is it Dad?,True,Attack of the Clones,,4
612,ANAKIN, Wait please.,True,Attack of the Clones,Male,2
613,WATTO, No not that one - that one!,True,Attack of the Clones,Male,7
614,ANAKIN, Excuse me Watto.,True,Attack of the Clones,Male,3
615,WATTO, What?,True,Attack of the Clones,Male,1
616,ANAKIN, I said excuse me.,True,Attack of the Clones,Male,4
617,WATTO, Shut down.,True,Attack of the Clones,Male,2
618,WATTO, What? I don't know you... What can I do for you? You look like a Jedi. Whatever it is... I didn't do it.,True,Attack of the Clones,Male,23
619,ANAKIN,Let me help you with that.,True,Attack of the Clones,Male,6
620,ANAKIN, I'm looking for Shmi Skywalker.,True,Attack of the Clones,Male,5
621,WATTO,Annie?? Little Annie?? Naaaah!!,True,Attack of the Clones,Male,4
622,WATTO, You are Annie! It is you! You little womp rat.,True,Attack of the Clones,Male,10
623,WATTO, You sure sprouted Weehoo! A Jedi! Waddya know? Hey maybe you couldda help wit some daedbeats who owe...,True,Attack of the Clones,Male,18
624,ANAKIN,My mother...,True,Attack of the Clones,Male,2
625,WATTO,Oh yeah. Shmi... she's not mine no more. I sold her.,True,Attack of the Clones,Male,11
626,ANAKIN,Sold her...,True,Attack of the Clones,Male,2
627,WATTO,Years ago. Sorry Anne but you know business is business. Sold her to a moisture farmer named Lars. Least I think it was Lars. Believe it or not I heard he freed her and married her. Can ya beat that?,True,Attack of the Clones,Male,40
628,ANAKIN,Do you know where they are?,True,Attack of the Clones,Male,6
629,WATTO,Long way from here... someplace over on the other side of Mos Eisley I think...,True,Attack of the Clones,Male,15
630,ANAKIN,I'd like to know.,True,Attack of the Clones,Male,4
631,WATTO,Yeah... sure... absolutely. Let's go look in my records.,True,Attack of the Clones,Male,9
632,LAMA SU,Tell your Council the first battalions are ready. And remind them that if they need more troops we will need time to grow them.,True,Attack of the Clones,Male,24
633,OBI-WAN,I won't forget.,True,Attack of the Clones,Male,3
634,BOBA FETT,Dad!!,True,Attack of the Clones,Male,1
635,PADME,Stay with the ship Artoo.,True,Attack of the Clones,Female,5
636,THREEPIO,Good evening. May I help you?,True,Attack of the Clones,Droid,6
637,ANAKIN,Threepio?,True,Attack of the Clones,Male,1
638,THREEPIO,Oh my... oh my! Master Anakin! My goodness I can hardly believe it! And this must be Miss Padme.,True,Attack of the Clones,Droid,19
639,PADME,Hello Threepio.,True,Attack of the Clones,Female,2
640,ANAKIN,I've come to see my mother.,True,Attack of the Clones,Male,6
641,THREEPIO,Oh dear! I'm so terribly sorry Master Annie.,True,Attack of the Clones,Droid,8
642,PADME,Threepio what's happened?,True,Attack of the Clones,Female,3
643,THREEPIO,I think we'd better go inside.,True,Attack of the Clones,Droid,6
644,THREEPIO,Master Lars - Master Owen! Somebody to see you!,True,Attack of the Clones,Droid,9
645,ANAKIN,I'm Anakin Skywalker. I'm here looking for my mother.,True,Attack of the Clones,Male,9
646,OWEN,Owen Lars... I guess I'm your step-brother.  This is my girlfriend Beru.,True,Attack of the Clones,Male,12
647,BERU,Hello.,True,Attack of the Clones,,1
648,PADME,I'm Padme.,True,Attack of the Clones,Female,2
649,OWEN,I had a feeling you might show up some day.,True,Attack of the Clones,Male,10
650,ANAKIN,Is my mother here?,True,Attack of the Clones,Male,4
651,CLIEGG,No she's not.,True,Attack of the Clones,Male,3
652,CLIEGG, Cliegg Lars. Shmi is my wife... Come on inside. We have a lot to talk about.,True,Attack of the Clones,Male,16
653,CLIEGG (O.S.),It was just before dawn. They came out of nowhere. A hunting party of Tusekn Raiders.,True,Attack of the Clones,Male,16
654,CLIEGG,Your mother had gone out early like she always did to pick mushrooms that grow on the vaporatos. From the tracks she was about halfway when they took her. Those Tuskens walk like men but they're vicious mindless monsters. Thirty of us went out after her. Four of us came back. Three more are still out there looking. I'd be with them only... I just couldn't ride any more... until I heal.,True,Attack of the Clones,Male,72
655,CLIEGG, This isn't the way I wanted to meet you son. This isn't how your mother and I planned it. I don't want to give up on her but she's been gone a month. There's little hope she's lasted this long.,True,Attack of the Clones,Male,40
656,OWEN,Where are you going?,True,Attack of the Clones,Male,4
657,ANAKIN,To find my mother.,True,Attack of the Clones,Male,4
658,PADME,No Annie!,True,Attack of the Clones,Female,2
659,CLIEGG,She's daed son. Accept it.,True,Attack of the Clones,Male,5
660,ANAKIN,I can feel her pain and I will find her. I know she's alive.,True,Attack of the Clones,Male,14
661,ANAKIN,You are going to have to stay here. These are good people Padme. You'll be safe.,True,Attack of the Clones,Male,16
662,OWEN,Take my speeder bike.,True,Attack of the Clones,Male,4
663,PADME,Anakin...,True,Attack of the Clones,Female,1
664,ANAKIN,I trust you'll watch over her Owen.,True,Attack of the Clones,Male,7
665,OWEN,Don't worry.,True,Attack of the Clones,Male,2
666,ANAKIN,I won't be long.,True,Attack of the Clones,Male,4
667,JANGO FETT,Nearly there son.,True,Attack of the Clones,Male,3
668,BOBA FETT,Dad look!!,True,Attack of the Clones,Male,2
669,JANGO FETT,Hang on!,True,Attack of the Clones,Male,2
670,BOBA FETT,Dad! Watch out!,True,Attack of the Clones,Male,3
671,JANGO FETT,Stay calm son. We'll be fine. That Jedi won't be able to follow us through this.,True,Attack of the Clones,Male,16
672,BOBA FETT,Got him! Yeahhhhh!,True,Attack of the Clones,Male,3
673,JANGO FETT,We won't see him again.,True,Attack of the Clones,Male,5
674,THREEPIO,Please don't leave us Miss Padme. These people need your help.,True,Attack of the Clones,Droid,11
675,PADME,I'm not leaving Threepio. I just can't sleep.,True,Attack of the Clones,Female,8
676,THREEPIO,That's something I cannot relate to. As a Protocol Droid I'm either active or inactive. There's no in-between.,True,Attack of the Clones,Droid,18
677,PADME,I guess you're lucky.,True,Attack of the Clones,Female,4
678,THREEPIO,Do you really think so..? I suppose I shouldn't expect...,True,Attack of the Clones,Droid,10
679,PADME,You're not happy here?,True,Attack of the Clones,Female,4
680,THREEPIO,Oh I'm not unhappy... and my masters here ar so kind I wouldn't wish to trouuble them it's just... being like this... well it's embarrassing.,True,Attack of the Clones,Droid,25
681,PADME,Being like what?,True,Attack of the Clones,Female,3
682,THREEPIO,Naked. If you pardon the expression. You see when Master Annie made me he never quite found the time to give me any outer covering. It's so humiliating. How would you like it if you had to go around with all your circuits showing?,True,Attack of the Clones,Droid,44
683,PADME,I guess I wouldn't like it at all.,True,Attack of the Clones,Female,8
684,THREEPIO,Of course you wouldn't. Nobody would. It's simply not protocol.,True,Attack of the Clones,Droid,10
685,PADME,Maybe we can do something about it.,True,Attack of the Clones,Female,7
686,THREEPIO,I don't think so. Only Master Annie...,True,Attack of the Clones,Droid,7
687,PADME,Why not? They seem to have a box of old coverings here.,True,Attack of the Clones,Female,12
688,THREEPIO,Oh? How observant of you Miss Padme. Of course I'm just not mechanically minded... if you see what I mean.,True,Attack of the Clones,Droid,20
689,PADME,Let's see if we put this... here...,True,Attack of the Clones,Female,7
690,THREEPIO,Ooooh! That's tickles.,True,Attack of the Clones,Droid,3
691,PADME,You'll have to be quiet Threepio. Hold still please.,True,Attack of the Clones,Female,9
